,event_time,event_date,year,month,day,hour,minute,city,state,shape,duration,summary,event_url
493,04-03-21T14:38:00Z,04-03-21,04,03,21,14,38,San Leandro,CA,Disk,21 seconds,"Blue UFO comes out of sky over San Leandro, California",http://www.nuforc.org/webreports/162/S162577.html
494,04-03-21T11:35:00Z,04-03-21,04,03,21,11,35,Windham,OH,,,MADAR Node 55,http://www.nuforc.org/webreports/162/S162760.html
495,04-03-21T05:43:00Z,04-03-21,04,03,21,05,43,Pine City,NY,,,MADAR Node 82,http://www.nuforc.org/webreports/162/S162756.html
496,04-03-21T05:30:00Z,04-03-21,04,03,21,05,30,Winnipeg (Canada),MB,Sphere,1 minute,Pulsating sphere interaction with a moving object,http://www.nuforc.org/webreports/162/S162633.html
497,04-03-21T00:00:00Z,04-03-21,04,03,21,00,00,Tioga,PA,Light,3 weeks,Noticed it a month ago. And every night since. Yellow glowing orbs rising from the damn. Our town I's built in the shadow of this damn.,http://www.nuforc.org/webreports/162/S162994.html
498,04-02-21T22:00:00Z,04-02-21,04,02,21,22,00,Clarkston,MI,Formation,3 seconds each,Two instances of a formation of three lights moving rapidly across the sky,http://www.nuforc.org/webreports/162/S162695.html
499,04-02-21T21:00:00Z,04-02-21,04,02,21,21,00,Nashville,TN,,10 seconds,Moving object vanishes as airplane approaches,http://www.nuforc.org/webreports/162/S162636.html
500,04-02-21T21:00:00Z,04-02-21,04,02,21,21,00,Arlington,WA,Light,3-5 seconds,"We saw a huge, green light flash, then move across the sky and dissapear.  It was very different than a shoiting star or slow moving sa",http://www.nuforc.org/webreports/162/S162634.html
501,04-02-21T21:00:00Z,04-02-21,04,02,21,21,00,Doylestown,PA,,2 hours,((NUFORC Note:  Witness provides no information about sighting; elects to remain totally anonymous.  PD)),http://www.nuforc.org/webreports/162/S162613.html
502,04-02-21T20:38:00Z,04-02-21,04,02,21,20,38,Shoreline,WA,Fireball,< 2 seconds,Greenish fireball streaking through sky at high velocity,http://www.nuforc.org/webreports/162/S162635.html
503,04-02-21T20:10:00Z,04-02-21,04,02,21,20,10,Oxford,PA,Oval,1minute,Red flying object,http://www.nuforc.org/webreports/162/S162637.html
504,04-02-21T06:57:00Z,04-02-21,04,02,21,06,57,Whately,MA,,,MADAR Node 67,http://www.nuforc.org/webreports/162/S162759.html
505,04-01-21T22:00:00Z,04-01-21,04,01,21,22,00,Salt Lake City,UT,Circle,45 minutes,"Unusually bright object in West sky.Stationary, it appeared to have some type of light occasionally coming from top.  Also had red, blu",http://www.nuforc.org/webreports/162/S162614.html
506,04-01-21T22:00:00Z,04-01-21,04,01,21,22,00,Watsonville,CA,Other,Two nights,Moon rose in two different spots,http://www.nuforc.org/webreports/163/S163283.html
507,04-01-21T20:41:00Z,04-01-21,04,01,21,20,41,Salem,OR,Oval,A few minutes,"UFO moving very slowly above neighborhood, paused nearby above house, moved fast away after, saw two entities in aircraft",http://www.nuforc.org/webreports/162/S162639.html
508,04-01-21T18:37:00Z,04-01-21,04,01,21,18,37,Boardman,OR,Triangle,4 minutes,Wormhole event filmed from Boardman OR,http://www.nuforc.org/webreports/162/S162609.html
509,04-01-21T15:30:00Z,04-01-21,04,01,21,15,30,,PA,Circle,20 seconds,I saw a super bright light while digging field drains.,http://www.nuforc.org/webreports/162/S162642.html
510,04-01-21T14:00:00Z,04-01-21,04,01,21,14,00,Watsonville,CA,Cylinder,3 minutes,Saw airplane fly into space midday,http://www.nuforc.org/webreports/163/S163270.html
511,04-01-21T02:00:00Z,04-01-21,04,01,21,02,00,Louisville,KY,Circle,past couple weeks,So this ships showed up a couple weeks ago. basically theres 3 i can point out every night now cause they go to same general area when,http://www.nuforc.org/webreports/162/S162645.html
512,03-31-21T21:30:00Z,03-31-21,03,31,21,21,30,"Hiko, Rachel NV",NV,Light,4 Minutes,Red ball of light with occasionally revolving green laser showing a metallic surface of a saucer. I have video.,http://www.nuforc.org/webreports/162/S162638.html
513,03-31-21T08:59:00Z,03-31-21,03,31,21,08,59,Hanover,MD,,,MADAR Node 77,http://www.nuforc.org/webreports/162/S162757.html
514,03-31-21T06:35:00Z,03-31-21,03,31,21,06,35,Camillus,NY,Formation,5+ minutes,Cluster of three bright lights,http://www.nuforc.org/webreports/162/S162545.html
515,03-31-21T05:50:00Z,03-31-21,03,31,21,05,50,Alcoa,TN,Triangle,8 seconds,Small black triangle with three solid white lights passed low over my car.,http://www.nuforc.org/webreports/162/S162669.html
516,03-31-21T03:34:00Z,03-31-21,03,31,21,03,34,Southampton,NJ,Light,3 seconds,Ball of white light moved across sky from south to north in about 3 seconds. It was about size of a golf ball compared to the moon.  It,http://www.nuforc.org/webreports/162/S162543.html
517,03-30-21T23:06:00Z,03-30-21,03,30,21,23,06,Arlington,TX,Light,15 minutes,"A bright pulsing light in DFW area of Texas with multiple colors, slowly moving down after 15 minutes.  ((Sirius??))",http://www.nuforc.org/webreports/162/S162643.html
518,03-30-21T23:06:00Z,03-30-21,03,30,21,23,06,Arlington,TX,Light,15 minutes,"A bright pulsing light in DFW area of Texas with multiple colors, slowly moving down after 15 minutes",http://www.nuforc.org/webreports/162/S162641.html
519,03-30-21T21:03:00Z,03-30-21,03,30,21,21,03,Erie,CO,,,MADAR Node 39,http://www.nuforc.org/webreports/162/S162761.html
520,03-30-21T20:42:00Z,03-30-21,03,30,21,20,42,Newport,RI,Unknown,10:59,(I HAVE ALL OF THIS ON VIDEO. 11 MINUTES) A &quot;light&quot; appeared in the night sky seemingly out of nowhere in the distance. I've,http://www.nuforc.org/webreports/162/S162608.html
521,03-30-21T20:29:00Z,03-30-21,03,30,21,20,29,Brewster,MA,Oval,4 minutes,Moving lights on dark mass,http://www.nuforc.org/webreports/162/S162538.html
522,03-30-21T11:35:00Z,03-30-21,03,30,21,11,35,Springfield,MO,,,MADAR Node 36,http://www.nuforc.org/webreports/162/S162762.html
523,03-30-21T09:30:00Z,03-30-21,03,30,21,09,30,Twin falls,ID,Fireball,5 minutes,"Hi this is real sigting i watched that and take the pictures, video they come from moon,red white yellow light ball they fly like so sc",http://www.nuforc.org/webreports/162/S162599.html
524,03-30-21T02:45:00Z,03-30-21,03,30,21,02,45,Largo,FL,Light,2 seconds,While orb falling before disappearing into thin air,http://www.nuforc.org/webreports/162/S162528.html
525,03-30-21T01:12:00Z,03-30-21,03,30,21,01,12,Huntington,NY,Rectangle,10 seconds,At 1:12 am on March 30th our ring device went off and we saw this strange object which could be a drone Showed it to many people.,http://www.nuforc.org/webreports/162/S162546.html
526,03-29-21T22:00:00Z,03-29-21,03,29,21,22,00,Boise,ID,Light,15 seconds,FAST MOVING CRAFT.,http://www.nuforc.org/webreports/162/S162542.html
527,03-29-21T20:30:00Z,03-29-21,03,29,21,20,30,Ringwood,NJ,Light,30 minutes,"Multiple objects witnessed,changed speed and direction, lights changed color and intensity",http://www.nuforc.org/webreports/162/S162526.html
528,03-29-21T19:00:00Z,03-29-21,03,29,21,19,00,Gloucester,MA,Sphere,30,Across Gloucester Harbor south of Eastern Point were to spheres hovering near the lighthouse area dimming then brightening their lights,http://www.nuforc.org/webreports/162/S162537.html
529,03-29-21T13:12:00Z,03-29-21,03,29,21,13,12,Uvalde,TX,,,MADAR Node 72,http://www.nuforc.org/webreports/162/S162758.html
530,03-29-21T05:16:00Z,03-29-21,03,29,21,05,16,Eads,TN,,,MADAR Node 32,http://www.nuforc.org/webreports/162/S162763.html
531,03-29-21T00:15:00Z,03-29-21,03,29,21,00,15,Largo,FL,Light,3 seconds,Very bright white orb seen exiting cloud and disappearing into thin air!,http://www.nuforc.org/webreports/162/S162529.html
532,03-28-21T21:30:00Z,03-28-21,03,28,21,21,30,Glenns Ferry,ID,Circle,10 seconds,Truck driver observes 3 bright lights,http://www.nuforc.org/webreports/162/S162541.html
533,03-28-21T21:01:00Z,03-28-21,03,28,21,21,01,Phoenix,AZ,Light,30-45 seconds,I was traveling in my car and looked over and seen a blue light/object in the sky traveling quickly from south to north. Once I stopped,http://www.nuforc.org/webreports/162/S162518.html
534,03-28-21T21:00:00Z,03-28-21,03,28,21,21,00,Apex,NC,Circle,1-2 seconds,Saw a fuzzy green orb moving at high speed in a straight line,http://www.nuforc.org/webreports/162/S162536.html
535,03-28-21T20:26:00Z,03-28-21,03,28,21,20,26,Troutman,NC,Cigar,4-5 seconds,"Driving down road, UFO passes overhead flying at 125 yards. And disappeared into the clouds.",http://www.nuforc.org/webreports/162/S162517.html
536,03-28-21T20:20:00Z,03-28-21,03,28,21,20,20,Summerfield,NC,Sphere,1-2 seconds,I saw a glowing green orb that split into 2 spheres that moved away from each other in opposite directions.,http://www.nuforc.org/webreports/162/S162519.html
537,03-28-21T16:30:00Z,03-28-21,03,28,21,16,30,Boulder,CO,Sphere,2 minutes,"Shiny sphere, high altitude, moving steadily west before disappearing",http://www.nuforc.org/webreports/162/S162527.html
538,03-28-21T13:00:00Z,03-28-21,03,28,21,13,00,Somerset,NJ,Cigar,2 minutes,I captured two ufos on my phone.,http://www.nuforc.org/webreports/162/S162601.html
539,03-28-21T01:30:00Z,03-28-21,03,28,21,01,30,Santee,CA,Light,Home,I have a video taken tonight. Two ? In the sky. I’m trying to upload.  ((NUFORC Note:  Source provides no contact information.  PD)),http://www.nuforc.org/webreports/162/S162513.html
540,03-28-21T01:30:00Z,03-28-21,03,28,21,01,30,Santee,CA,Light,Home,I have a video taken tonight. Two ? In the sky. I’m trying to upload,http://www.nuforc.org/webreports/162/S162511.html
541,03-27-21T23:00:00Z,03-27-21,03,27,21,23,00,Yorba linda,CA,Light,,"Object in sky above me walking my dog. Came down about 100ft. Above me and a blue bright light flashed. moving in a very strange way, v",http://www.nuforc.org/webreports/162/S162516.html
542,03-27-21T22:00:00Z,03-27-21,03,27,21,22,00,cynthiana,LA,Circle,30 minutes,"my best friend and i were sitting on the porch i was facing the roof toward the road, we were behind the house, and she was facing the",http://www.nuforc.org/webreports/162/S162496.html
543,03-27-21T04:34:00Z,03-27-21,03,27,21,04,34,Moses lake,WA,Unknown,30,It’s really hard to explain... other than at first sight would be a meteorite. But after only a second I could quickly understand that,http://www.nuforc.org/webreports/162/S162503.html
544,03-27-21T02:00:00Z,03-27-21,03,27,21,02,00,St. Petersburg,FL,Flash,~2 seconds,White bright quick light,http://www.nuforc.org/webreports/162/S162500.html
545,03-27-21T01:57:00Z,03-27-21,03,27,21,01,57,West Chazy,NY,,,MADAR Node 65,http://www.nuforc.org/webreports/162/S162754.html
546,03-27-21T01:40:00Z,03-27-21,03,27,21,01,40,Cincinnati,OH,Chevron,1 minute or less,"UFO sighting on 3/27 01:40 and I have 2 pictures, one pic looks like a green chevron the other a blue egg/cyclinder shape",http://www.nuforc.org/webreports/162/S162666.html
547,03-26-21T22:35:00Z,03-26-21,03,26,21,22,35,Seffner,FL,Changing,30 seconds,"Changing shapes, orange and gold colored",http://www.nuforc.org/webreports/162/S162506.html
548,03-26-21T20:14:00Z,03-26-21,03,26,21,20,14,Youngstown,OH,,,MADAR Node 73,http://www.nuforc.org/webreports/162/S162753.html
549,03-26-21T07:15:00Z,03-26-21,03,26,21,07,15,Luning,NV,Triangle,90-120 seconds,US Military transporting &quot;UFO&quot; in Nevada,http://www.nuforc.org/webreports/162/S162960.html
550,03-26-21T05:30:00Z,03-26-21,03,26,21,05,30,New Castle,PA,Oval,5 minutes,Oval craft with red and white lights hovering over trees,http://www.nuforc.org/webreports/162/S162479.html
551,03-26-21T05:07:00Z,03-26-21,03,26,21,05,07,Gilching (Germany),,Formation,1 minute,"Line of bright stars, moving rapidly across Germany´s western skies.  ((Starlink satellite??))",http://www.nuforc.org/webreports/162/S162476.html
552,03-26-21T03:02:00Z,03-26-21,03,26,21,03,02,Wenatchee,WA,Sphere,5 seconds,I was heading northbound on White Trails rd between quincy wa and wenatchee wa on my way to wenatchee wa. I was a couple miles south of,http://www.nuforc.org/webreports/162/S162504.html
553,03-25-21T23:15:00Z,03-25-21,03,25,21,23,15,Chilliwack (Canada),BC,Light,30 seconds,Large bright white light in the night sky that suddenly vanished in an instant!,http://www.nuforc.org/webreports/162/S162481.html
554,03-25-21T22:00:00Z,03-25-21,03,25,21,22,00,Gig Harbor,WA,Changing,10 minutes,Large hovering black object with lights appeared and then changed into several orange orbs.  No sound and slow moving.,http://www.nuforc.org/webreports/163/S163150.html
555,03-25-21T21:15:00Z,03-25-21,03,25,21,21,15,The Dalles,OR,Fireball,1 minute,"A bright ball to the right of mt hood (south west of here) coming closer and becoming brighter, 0.2 inches at arms length.  ((re-entry)",http://www.nuforc.org/webreports/162/S162489.html
556,03-25-21T21:00:00Z,03-25-21,03,25,21,21,00,Seattle,WA,Formation,45 seconds,Formation of 8-10 arrowhead orange lights.  ((Starlink satellites)),http://www.nuforc.org/webreports/162/S162490.html
557,03-25-21T21:00:00Z,03-25-21,03,25,21,21,00,Port Ludlow,WA,Flash,60 seconds,"There are currently 6 drones above tge Bay in Port Ludlow, we were outside looking at them when something moving horizontally flashed a",http://www.nuforc.org/webreports/162/S162493.html
558,03-25-21T21:00:00Z,03-25-21,03,25,21,21,00,Sequim,WA,Cone,70 seconds,UFO fleet!,http://www.nuforc.org/webreports/162/S162491.html
559,03-25-21T21:00:00Z,03-25-21,03,25,21,21,00,Corvallis (just north of),OR,Cigar,25 seconds,((NUFORC Note:  Witness provides no detailed information.  PD)),http://www.nuforc.org/webreports/162/S162488.html
560,03-25-21T21:00:00Z,03-25-21,03,25,21,21,00,Richland,WA,Fireball,1 minute,"Slow moving cluster of fireballs crossing from SW to NE over the Tri-Cities, WA.  ((Starlink satellites??))",http://www.nuforc.org/webreports/162/S162486.html
561,03-25-21T21:00:00Z,03-25-21,03,25,21,21,00,Centralia,WA,Formation,5 seconds,V formation of 7-9 white orbs moving quickly beneath the moon,http://www.nuforc.org/webreports/162/S162485.html
562,03-25-21T21:00:00Z,03-25-21,03,25,21,21,00,Kirkland,WA,Fireball,2 minutes,I have a live video I would like to submit.,http://www.nuforc.org/webreports/162/S162480.html
563,03-25-21T21:00:00Z,03-25-21,03,25,21,21,00,Oak Harbor,WA,Formation,1 min,Slow moving formation of lights.  Looked like a combination between a massive freight train and a comet.  ((Falcon 9 re-entry??)),http://www.nuforc.org/webreports/162/S162478.html
564,03-25-21T21:00:00Z,03-25-21,03,25,21,21,00,Langford (Canada),BC,Disk,5 minutes,6 lights surrounding a disc shap and moving,http://www.nuforc.org/webreports/162/S162492.html
565,03-25-21T20:40:00Z,03-25-21,03,25,21,20,40,Everett,WA,Light,,"On the freeway - driving - everyone slowed down - some were swerving- So many lights, big and small - some in a haze -  it looked like",http://www.nuforc.org/webreports/162/S162482.html
566,03-25-21T20:05:00Z,03-25-21,03,25,21,20,05,Peterborough,NH,Oval,30 seconds,"Miller State Park UFO sighting, 900sqf object hovering above tree line",http://www.nuforc.org/webreports/162/S162512.html
567,03-25-21T19:45:00Z,03-25-21,03,25,21,19,45,Peoria,AZ,Cigar,2 minutes,"Large cigar shaped, low flying craft with solid lights spotted in Peoria, AZ",http://www.nuforc.org/webreports/162/S162592.html
568,03-25-21T19:40:00Z,03-25-21,03,25,21,19,40,Peoria,AZ,Cigar,1 minute,Update to Peoria report 03/25/2021,http://www.nuforc.org/webreports/162/S162607.html
569,03-25-21T19:40:00Z,03-25-21,03,25,21,19,40,Peoria,AZ,Cigar,1 minute,Large  object with multiple white lights- Peoria Az,http://www.nuforc.org/webreports/162/S162475.html
570,03-25-21T19:30:00Z,03-25-21,03,25,21,19,30,Vancouver Bc  (Canada),BC,Disk,20 seconds,"It looked as ,if a jient Disk shaped object that was de-cloking as was cruising across burning with fire around the front of the Rme,",http://www.nuforc.org/webreports/162/S162515.html
571,03-25-21T19:00:00Z,03-25-21,03,25,21,19,00,White Plains,NY,Cylinder,48 mins,saw dark object with no lights and making no noise moving in a NE direction.,http://www.nuforc.org/webreports/162/S162477.html
572,03-25-21T10:15:00Z,03-25-21,03,25,21,10,15,Milwaukee,OR,,7 minutes,((NUFORC Note:  Witness provides no detailed information.  PD)),http://www.nuforc.org/webreports/162/S162505.html
573,03-25-21T09:10:00Z,03-25-21,03,25,21,09,10,Mount Vernon,WA,Formation,30 seconds,White dots in a straight line going across the lake high in sky,http://www.nuforc.org/webreports/162/S162494.html
574,03-25-21T09:00:00Z,03-25-21,03,25,21,09,00,Portland,OR,Circle,10 seconds,"What appeared to be meteors were not in one single file line but messy, and after seen, booms were heard and a momentary shaking",http://www.nuforc.org/webreports/162/S162487.html
575,03-25-21T06:20:00Z,03-25-21,03,25,21,06,20,Apollo Beach,FL,Chevron,Seconds,Saw a chevron shaped object move across the sky from South to North.,http://www.nuforc.org/webreports/162/S162524.html
576,03-24-21T21:00:00Z,03-24-21,03,24,21,21,00,North Bend,OR,Light,10-20 seconds,"Two Orb-Shaped UFOs Spotted Over North Bend, OR",http://www.nuforc.org/webreports/162/S162461.html
577,03-24-21T20:36:00Z,03-24-21,03,24,21,20,36,Muskogee,OK,Light,20 minutes,Orange Lights in Muskogee Sky,http://www.nuforc.org/webreports/162/S162473.html
578,03-24-21T19:30:00Z,03-24-21,03,24,21,19,30,Moosup,CT,Fireball,5 minutes,I saw six fireballs of light in the sky strung like lights that moved with intent and intelligence.  ((Starlink satellites??)),http://www.nuforc.org/webreports/162/S162540.html
579,03-24-21T06:10:00Z,03-24-21,03,24,21,06,10,Grass Valley,CA,Cigar,30 seconds,Square lights moving across the sky.  ((Starlink satellites??)),http://www.nuforc.org/webreports/162/S162464.html
580,03-23-21T00:00:00Z,03-23-21,03,23,21,00,00,Port Jefferson Station,NY,Changing,40 seconds,UFO Second occurrence on Long Island NY in SAME/CLOSE TOWN HAPPENED SAME DATE roughly same time evening 1 month apart,http://www.nuforc.org/webreports/162/S162742.html
581,03-23-21T23:30:00Z,03-23-21,03,23,21,23,30,Clifton Springs,NY,Circle,1 hour,Round object swaying back and forth.Changing coloring. Not moving very far.Seen the same the night before.,http://www.nuforc.org/webreports/162/S162450.html
582,03-23-21T21:00:00Z,03-23-21,03,23,21,21,00,Brunswick,GA,Circle,15 seconds,"Round object, Bright amber color moving silently at high speed with fluid like motions.",http://www.nuforc.org/webreports/162/S162451.html
583,03-23-21T20:28:00Z,03-23-21,03,23,21,20,28,Camas,WA,Sphere,15 minutes,"2 orange-yellow balls of light traveled and then stopped, pulsating and flickering in and out",http://www.nuforc.org/webreports/163/S163289.html
584,03-23-21T20:06:00Z,03-23-21,03,23,21,20,06,Happy Valley,OR,Unknown,minutes,Saw a moving object in the Northern Sky. Appears to be to low to be a satellite and no blinking lights of a plane.,http://www.nuforc.org/webreports/162/S162465.html
585,03-23-21T14:45:00Z,03-23-21,03,23,21,14,45,Kansas City,MO,,,MADAR Node 40,http://www.nuforc.org/webreports/162/S162755.html
586,03-23-21T01:30:00Z,03-23-21,03,23,21,01,30,Chaska,MN,Fireball,5 minutes,"4 glowing red balls traveling east to west, no blinking, no noise, 2 witnesses",http://www.nuforc.org/webreports/162/S162455.html
587,03-22-21T23:37:00Z,03-22-21,03,22,21,23,37,Clarksburg,MD,Oval,5 seconds,Looked up and noticed a cylindrical object moving horizontal in the sky with what almost looked like a flame like tail.,http://www.nuforc.org/webreports/162/S162454.html
588,03-22-21T16:41:00Z,03-22-21,03,22,21,16,41,Lyndhurst,VA,Oval,5 seconds,Mt. Torrey road near Chinquapin Dr highly reflective oval shape spotted above tree line was almost stationary before dipping down quick,http://www.nuforc.org/webreports/162/S162448.html
589,03-22-21T09:45:00Z,03-22-21,03,22,21,09,45,Coeburn,VA,Oval,30 seconds,It wasn’t a shooting star or plane I know what I saw,http://www.nuforc.org/webreports/162/S162870.html
590,03-21-21T20:35:00Z,03-21-21,03,21,21,20,35,Annapolis,MD,Formation,10 minutes,"Red, green, white, and blue lights moving across sky in Annapolis, MD.",http://www.nuforc.org/webreports/162/S162442.html
591,03-21-21T15:36:00Z,03-21-21,03,21,21,15,36,Hillsborough,NJ,Cylinder,30,Slow moving long vertical object with two orange and one green lights.,http://www.nuforc.org/webreports/162/S162444.html
592,03-21-21T13:00:00Z,03-21-21,03,21,21,13,00,Stafford Springs,CT,Other,20 seconds,"The floating object appeared South of my location the sun directly overhead on a cloudless sky . No trees to block vision , not looking",http://www.nuforc.org/webreports/162/S162560.html
593,03-21-21T07:07:00Z,03-21-21,03,21,21,07,07,Douglassville,PA,Unknown,10 seconds,watch the video.,http://www.nuforc.org/webreports/162/S162443.html
594,03-21-21T06:25:00Z,03-21-21,03,21,21,06,25,Albany,GA,Rectangle,1,The pole light was flicking,http://www.nuforc.org/webreports/162/S162525.html
595,03-21-21T00:00:00Z,03-21-21,03,21,21,00,00,Iceland,,,15,"Blue Orbs floating around Fagradals Mountain, Iceland on live stream",http://www.nuforc.org/webreports/162/S162440.html
596,03-20-21T21:45:00Z,03-20-21,03,20,21,21,45,Presque Isle,ME,Light,30 seconds,"Three white dull lights in triangle formation, moved fast and disappeared.",http://www.nuforc.org/webreports/162/S162446.html
597,03-20-21T20:15:00Z,03-20-21,03,20,21,20,15,Wikiup,AZ,Fireball,35-40 minutes,"Several red fireball lights, fading in and out of view on the horizon, with occasional white explosive lights.",http://www.nuforc.org/webreports/162/S162447.html
598,03-20-21T20:00:00Z,03-20-21,03,20,21,20,00,Levant,ME,Sphere,5 minutes,Several amber spheres hovering silently,http://www.nuforc.org/webreports/162/S162495.html
599,03-20-21T13:07:00Z,03-20-21,03,20,21,13,07,Pine City,NY,,,MADAR Node 82,http://www.nuforc.org/webreports/162/S162617.html
600,03-20-21T02:13:00Z,03-20-21,03,20,21,02,13,Boise,ID,,,MADAR Node 111,http://www.nuforc.org/webreports/162/S162616.html
601,03-19-21T22:38:00Z,03-19-21,03,19,21,22,38,Scottsdale,AZ,Light,1,"High Speed Light in sky SW of North Scottsdale, AZ.",http://www.nuforc.org/webreports/162/S162428.html
602,03-19-21T20:15:00Z,03-19-21,03,19,21,20,15,Ellicott City,MD,Changing,10 seconds,"Seen and object 2 times, 1er time it look like a light and it will turn light on and off, 2 time 2 minutes later , my son in the car sa",http://www.nuforc.org/webreports/162/S162441.html
603,03-19-21T20:00:00Z,03-19-21,03,19,21,20,00,Richboro,PA,Light,3 seconds,Bright white light at high speed SE of Richboro,http://www.nuforc.org/webreports/162/S162425.html
604,03-19-21T16:44:00Z,03-19-21,03,19,21,16,44,Coshocton,OH,Unknown,2 minutes or longer,Unknown object.,http://www.nuforc.org/webreports/162/S162419.html
605,03-19-21T16:05:00Z,03-19-21,03,19,21,16,05,Santa Barbara,CA,,,MADAR Node 57,http://www.nuforc.org/webreports/162/S162618.html
606,03-19-21T16:00:00Z,03-19-21,03,19,21,16,00,Tampa,FL,Other,5 seconds,"SIGHTING IN TAMPA, FL  03/19/2021.",http://www.nuforc.org/webreports/162/S162466.html
607,03-19-21T12:00:00Z,03-19-21,03,19,21,12,00,Hannibal,MO,Oval,20+ minutes,We saw what looked like a school of 100+ gray and white orbs.,http://www.nuforc.org/webreports/162/S162521.html
608,03-19-21T05:36:00Z,03-19-21,03,19,21,05,36,Franklin,KY,,,MADAR Node 54,http://www.nuforc.org/webreports/162/S162619.html
609,03-19-21T04:00:00Z,03-19-21,03,19,21,04,00,Houston,TX,Light,2 seconds,Video game controller shaped spaceship shoots across the sky early in the morning hours,http://www.nuforc.org/webreports/162/S162418.html
610,03-19-21T00:37:00Z,03-19-21,03,19,21,00,37,Delta,CO,Fireball,,"A large bright light that traveled slowly, then hovered, seemed to get dimmer and brighter then appeared to fall down toward horizon. I",http://www.nuforc.org/webreports/162/S162434.html
611,03-18-21T06:09:00Z,03-18-21,03,18,21,06,09,Furlong,PA,,,MADAR Node 38,http://www.nuforc.org/webreports/162/S162620.html
612,03-18-21T05:02:00Z,03-18-21,03,18,21,05,02,Plymouth,UT,Other,3 minutes,String of 30+ perfect lights and the bright lights breaking into triangles there and gone.  ((Starlink satellites??)),http://www.nuforc.org/webreports/162/S162410.html
613,03-18-21T00:00:00Z,03-18-21,03,18,21,00,00,Portland,OR,Diamond,6 minutes,"Small, star-like object appears in Oregon nighttime sky.",http://www.nuforc.org/webreports/162/S162429.html
614,03-17-21T23:15:00Z,03-17-21,03,17,21,23,15,Mansfield,OH,Rectangle,5 minutes,Rapid glittering white lights.,http://www.nuforc.org/webreports/162/S162934.html
615,03-17-21T23:00:00Z,03-17-21,03,17,21,23,00,Chugiak,AK,Light,2 minutes,Blue lights in sky,http://www.nuforc.org/webreports/162/S162420.html
616,03-17-21T21:20:00Z,03-17-21,03,17,21,21,20,Kure Beach,NC,Other,5 minutes,Lights with fired object from larger craft,http://www.nuforc.org/webreports/162/S162501.html
617,03-17-21T20:50:00Z,03-17-21,03,17,21,20,50,Lehi,UT,Light,5 minutes,Bright white light that turned to red and vanished.,http://www.nuforc.org/webreports/162/S162411.html
618,03-17-21T19:25:00Z,03-17-21,03,17,21,19,25,Pasadena,MD,Light,2 minutes,Bright flying object hovered then disappeared in the sky,http://www.nuforc.org/webreports/162/S162413.html
619,03-17-21T16:22:00Z,03-17-21,03,17,21,16,22,Woodland Hills,CA,Sphere,2 minutes,"Two white, spherical shaped craft flying Eastbound over Ventura Boulevard from Sale Avenue. Very slow, maybe about 25mph and at about t",http://www.nuforc.org/webreports/162/S162415.html
620,03-17-21T11:00:00Z,03-17-21,03,17,21,11,00,EK Balam (Yucatan)(Mexico),,Sphere,Instant,"We took this picture of my family sitting on the top of a Mayan pyramid at Ek Balam, MX and later noticed the UFO above my son's head h",http://www.nuforc.org/webreports/162/S162539.html
621,03-17-21T08:00:00Z,03-17-21,03,17,21,08,00,Fredericksburg,VA,Light,30 seconds,Orange lights interacting with each other,http://www.nuforc.org/webreports/162/S162414.html
