,event_time,event_date,year,month,day,hour,minute,city,state,shape,duration,summary,event_url
370,04-18-21T17:52:00Z,04-18-21,04,18,21,17,52,Hollywood,FL,Other,~10-15 seconds,My girlfriend and I were seated on her 15th floor balcony facing due west towards the adjacent intracoastal waterway. At approximat,http://www.nuforc.org/webreports/162/S162746.html
371,04-18-21T16:47:00Z,04-18-21,04,18,21,16,47,Teaneck,NJ,,,MADAR Node 28,http://www.nuforc.org/webreports/163/S163133.html
372,04-18-21T14:03:00Z,04-18-21,04,18,21,14,03,Garrettsville,OH,,,MADAR Node 64,http://www.nuforc.org/webreports/163/S163124.html
373,04-18-21T04:20:00Z,04-18-21,04,18,21,04,20,Independence,KS,Light,5 minutes,Driving home early morning 3 bright orange lights were witnessed on the south side of the city on highway 75,http://www.nuforc.org/webreports/162/S162767.html
374,04-17-21T21:45:00Z,04-17-21,04,17,21,21,45,Indianapolis,IN,Light,Hours,"All the time see this u.f.o outside of my house, it has been outside of my house for about 2-3 years now. I see all throughout the year",http://www.nuforc.org/webreports/162/S162743.html
375,04-17-21T20:25:00Z,04-17-21,04,17,21,20,25,Valdosta,GA,Circle,3 minutes,When looking at the weather radar a round object was detected. The radar signal showed the clouds changing as if a pebble was tossed in,http://www.nuforc.org/webreports/162/S162773.html
376,04-17-21T08:00:00Z,04-17-21,04,17,21,08,00,Church Hill,TN,Changing,All morning,"Maybe it's not, maybe its light and clouds or there is an explanation.",http://www.nuforc.org/webreports/162/S162775.html
377,04-17-21T06:21:00Z,04-17-21,04,17,21,06,21,Irmo,SC,,,MADAR Node 95,http://www.nuforc.org/webreports/162/S162806.html
378,04-17-21T03:00:00Z,04-17-21,04,17,21,03,00,Porter,OK,Unknown,5 seconds,Two bright white objects fly across sky,http://www.nuforc.org/webreports/162/S162738.html
379,04-17-21T00:00:00Z,04-17-21,04,17,21,00,00,Lexington,KY,Circle,20 minutes,"I was bird watching, as I was looking up at the sky I noticed something circle shaped color of aluminum foil in the sky at first I thou",http://www.nuforc.org/webreports/162/S162881.html
380,04-16-21T23:15:00Z,04-16-21,04,16,21,23,15,Sanford,FL,,,MADAR Node 91,http://www.nuforc.org/webreports/162/S162807.html
381,04-16-21T22:49:00Z,04-16-21,04,16,21,22,49,Sanford,FL,,,MADAR Node 91,http://www.nuforc.org/webreports/162/S162808.html
382,04-16-21T21:50:00Z,04-16-21,04,16,21,21,50,Kent,WA,Circle,3-5 seconds,I was driving north on the Kent Black Diamond Rd. I had passed Jenkins Creek and there was farmland to my left. All of a sudden at arou,http://www.nuforc.org/webreports/162/S162731.html
383,04-16-21T21:48:00Z,04-16-21,04,16,21,21,48,Corona,CA,Circle,45 seconds,"Alerted by my German Shepherd, I saw a very ultra white, very bright round light slowly traveling west.",http://www.nuforc.org/webreports/162/S162904.html
384,04-16-21T19:00:00Z,04-16-21,04,16,21,19,00,Port Washington,WI,Disk,few hours,"During the week off April 12, 2021- I saw a disk or saucer shape object in the North sky.It did have red and blue flashing lights-which",http://www.nuforc.org/webreports/162/S162790.html
385,04-16-21T16:00:00Z,04-16-21,04,16,21,16,00,Longview,WA,Oval,4 minutes,Flat oval shaped object in the sky that suddenly disappeared.,http://www.nuforc.org/webreports/162/S162748.html
386,04-16-21T14:42:00Z,04-16-21,04,16,21,14,42,Imperial,MO,,,MADAR Node 25,http://www.nuforc.org/webreports/162/S162810.html
387,04-16-21T11:32:00Z,04-16-21,04,16,21,11,32,Tucson,AZ,Disk,1/500 second,Unknown fast object appears in down-loaded photo,http://www.nuforc.org/webreports/162/S162938.html
388,04-16-21T10:08:00Z,04-16-21,04,16,21,10,08,Kaneohe,HI,Unknown,35 minutes,"An array of sparkley, multicolored lights in the far distance that did not move for 30 minutes from when I observed it.",http://www.nuforc.org/webreports/162/S162729.html
389,04-16-21T10:08:00Z,04-16-21,04,16,21,10,08,Kaneohe,HI,Unknown,35 minutes,"UFO on Oahu.  ((NUFORC Note:  Possibly the star, Sirius??  PD))",http://www.nuforc.org/webreports/162/S162727.html
390,04-16-21T05:00:00Z,04-16-21,04,16,21,05,00,Palm Coast,FL,Circle,30 seconds,Saw a black circle right below the cloudline then it rose into the clouds,http://www.nuforc.org/webreports/162/S162713.html
391,04-15-21T23:00:00Z,04-15-21,04,15,21,23,00,Cheswick,PA,Other,5 minutes,crescent moon shaped object that changed shape and disappeared.,http://www.nuforc.org/webreports/162/S162737.html
392,04-15-21T22:45:00Z,04-15-21,04,15,21,22,45,Bordentown,NJ,Triangle,30 seconds,Single orange fiery triangle.  Faded slowly then vanished within seconds.,http://www.nuforc.org/webreports/162/S162717.html
393,04-15-21T22:16:00Z,04-15-21,04,15,21,22,16,Shoreline,WA,Formation,2-4 seconds,Dark colored formation of objects traveling from the south to north just north of Seattle. (APR 15 21:10:16PM)((Starlink satellites??)),http://www.nuforc.org/webreports/162/S162706.html
394,04-15-21T21:30:00Z,04-15-21,04,15,21,21,30,West Linn,OR,Light,70 minutes,flashing color-changing light in south sky.  ((NUFORC Note:  Possibly Sirius??  PD)),http://www.nuforc.org/webreports/162/S162733.html
395,04-15-21T20:00:00Z,04-15-21,04,15,21,20,00,St. Charles,IL,Rectangle,5 seconds,"Saw two ufos at 8 pm in St. Charles, IL on 4/15/21, each ufo had 2 blue glowing rectangles, and flew over Meijer grocery store.",http://www.nuforc.org/webreports/162/S162715.html
396,04-15-21T17:30:00Z,04-15-21,04,15,21,17,30,Edisto,SC,Sphere,3 minutes,Lingering ufo being pursued by military crafts,http://www.nuforc.org/webreports/162/S162718.html
397,04-15-21T08:40:00Z,04-15-21,04,15,21,08,40,Streetsboro,OH,Light,5 minutes,cluster of bright lights in non specific formation,http://www.nuforc.org/webreports/162/S162724.html
398,04-15-21T05:13:00Z,04-15-21,04,15,21,05,13,Jonesboro,AR,,,MADAR Node 143,http://www.nuforc.org/webreports/162/S162805.html
399,04-15-21T02:00:00Z,04-15-21,04,15,21,02,00,Tucson,AZ,Unknown,30 seconds,I stepped outside for a smoke. It was absolutely quiet and I spotted something moving above me what seemed translucent like a cloaking,http://www.nuforc.org/webreports/162/S162716.html
400,04-15-21T00:45:00Z,04-15-21,04,15,21,00,45,Omaha,NE,Oval,15 minutes,We saw 3 glowing oval objects in the sky last night.,http://www.nuforc.org/webreports/162/S162720.html
401,04-14-21T23:29:00Z,04-14-21,04,14,21,23,29,"Washington, DC",DC,Triangle,1 hour,"Washington, DC, craft and sky events",http://www.nuforc.org/webreports/162/S162992.html
402,04-14-21T21:15:00Z,04-14-21,04,14,21,21,15,Springfield,IL,Formation,5 seconds,Fast moving v formation high in the night sky.,http://www.nuforc.org/webreports/162/S162723.html
403,04-14-21T18:52:00Z,04-14-21,04,14,21,18,52,,NJ,Other,15 minutes,Object was high (one to two thousand feet?). Was metallic. Kept having aura flash around it which would obscure the flying object entir,http://www.nuforc.org/webreports/163/S163259.html
404,04-14-21T04:05:00Z,04-14-21,04,14,21,04,05,Shelbyville,TN,Triangle,Minutes,"On April 14th,Iowa's up late as usual,well I looked at the clock and saw how late it was;therefore,I decided to smoke one more cigarett",http://www.nuforc.org/webreports/162/S162707.html
405,04-13-21T23:38:00Z,04-13-21,04,13,21,23,38,Oaklandon,IN,,,MADAR Node 87,http://www.nuforc.org/webreports/162/S162809.html
406,04-13-21T23:30:00Z,04-13-21,04,13,21,23,30,Valdosta,GA,Light,10 seconds,Small ball of white light moving very fast across the sky with no sound or contrail,http://www.nuforc.org/webreports/162/S162721.html
407,04-13-21T23:00:00Z,04-13-21,04,13,21,23,00,Collins,MS,Light,10 minutess,"UFOs flashing lights and flying over remote forest area in Collins, MS for the 2nd time",http://www.nuforc.org/webreports/162/S162699.html
408,04-13-21T22:15:00Z,04-13-21,04,13,21,22,15,West Bridgewater,MA,Triangle,10 seconds,Triangular shaped craft with star field camouflage on underside which made no engine noise as it passed overhead.,http://www.nuforc.org/webreports/162/S162741.html
409,04-13-21T14:00:00Z,04-13-21,04,13,21,14,00,Bellevue,WA,Triangle,5 minutes,Pulsating triangle object moving across a blue sky matching People video:https://people.com/human-interest/pentagon-confirms-that-shock,http://www.nuforc.org/webreports/162/S162732.html
410,04-12-21T22:50:00Z,04-12-21,04,12,21,22,50,Coral Springs,FL,Oval,3 hours,Orbs zig zagging and circular patterns.,http://www.nuforc.org/webreports/162/S162696.html
411,04-12-21T22:15:00Z,04-12-21,04,12,21,22,15,Alton,IN,Other,75 minutes,What I thought was supernova clearly was not,http://www.nuforc.org/webreports/162/S162689.html
412,04-12-21T20:30:00Z,04-12-21,04,12,21,20,30,Grady,NM,Other,15 seconds,Observed bright white flashes seemed to moved to the south.,http://www.nuforc.org/webreports/162/S162694.html
413,04-12-21T18:15:00Z,04-12-21,04,12,21,18,15,Port Charlotte,FL,Unknown,5 minutes,Appeared to be two balls connected by an S shape twirling on itself and changing rotation direction  Have 2 Videos from two different C,http://www.nuforc.org/webreports/162/S162739.html
414,04-12-21T10:20:00Z,04-12-21,04,12,21,10,20,Kissimmee,FL,Cylinder,3 seconds,It was a cylinder shaped craft that appeared out of no where and descended towards the ground very quickly. It looked like it had gold,http://www.nuforc.org/webreports/162/S162688.html
415,04-12-21T00:00:00Z,04-12-21,04,12,21,00,00,Portland,OR,Fireball,10 seconds,Seen a lot more in the past have very much encounters no reason to make things up April 2019 I've seen others I mention seeing fog Bank,http://www.nuforc.org/webreports/162/S162681.html
416,04-11-21T22:01:00Z,04-11-21,04,11,21,22,01,Monticello,UT,Formation,5 seconds,Odd shimmering lights over Midwest,http://www.nuforc.org/webreports/162/S162674.html
417,04-11-21T22:00:00Z,04-11-21,04,11,21,22,00,Moore,TX,Circle,5 minutes,"Original sighting 04/10/21 2am So.Texas thousands of circles with a ufo/meteor entering atmosphere and turning away. Tonight, 10-12 cir",http://www.nuforc.org/webreports/162/S162675.html
418,04-11-21T22:00:00Z,04-11-21,04,11,21,22,00,Baltimore,MD,Changing,20 minutes,"Pulsating orb, miles in the sky remained still. Broke into multiple lights, then back into 1. Disappeared after 20 minutes.",http://www.nuforc.org/webreports/162/S162655.html
419,04-11-21T20:50:00Z,04-11-21,04,11,21,20,50,Portland,OR,Sphere,30 seconds,"Orange sphere crosses overhead in Portland,  Oregon",http://www.nuforc.org/webreports/162/S162676.html
420,04-11-21T20:35:00Z,04-11-21,04,11,21,20,35,Altoona,AL,Other,3 minutes,Orbital object over N. Alabama that twice came to stop and made sudden course corrections,http://www.nuforc.org/webreports/162/S162656.html
421,04-11-21T20:30:00Z,04-11-21,04,11,21,20,30,Camas,WA,Rectangle,10 seconds,"Large black rectangle with no lights, moving slowly, followed by what appeared to be a helicopter",http://www.nuforc.org/webreports/162/S162660.html
422,04-11-21T16:29:00Z,04-11-21,04,11,21,16,29,Gastonia,NC,Rectangle,Caught by camera,I had a friend take a of a fish I caught and we didn’t see the craft in the upper right hand corner at the time put when I got home I s,http://www.nuforc.org/webreports/162/S162734.html
423,04-11-21T10:00:00Z,04-11-21,04,11,21,10,00,Palatine,IL,Light,10 minutes,Three lit objects below the cloud line.,http://www.nuforc.org/webreports/162/S162680.html
424,04-11-21T04:05:00Z,04-11-21,04,11,21,04,05,Cincinnati,OH,Sphere,4 minutes,Videotaped a yellow blinking sphere and another orange orb below,http://www.nuforc.org/webreports/162/S162685.html
425,04-11-21T00:00:00Z,04-11-21,04,11,21,00,00,Hooper,CO,Unknown,4 hours,Nothern Light-colored objects and star-like objects moving in sky near Great Sand Dunes Colorado,http://www.nuforc.org/webreports/162/S162708.html
426,04-10-21T21:45:00Z,04-10-21,04,10,21,21,45,Edmond,OK,Cylinder,10 minutes,12 yellow fireballs that made patterns with a cylindrical object below the lights not visible with the naked eye.,http://www.nuforc.org/webreports/162/S162745.html
427,04-10-21T21:45:00Z,04-10-21,04,10,21,21,45,Terre Haute,IN,Circle,1 minute,Unidentified Non-Drone Object,http://www.nuforc.org/webreports/162/S162697.html
428,04-10-21T21:40:00Z,04-10-21,04,10,21,21,40,Tucson,AZ,Chevron,4-6 seconds,A soft white couple of opposing chevrons flew silently over.,http://www.nuforc.org/webreports/162/S162782.html
429,04-10-21T21:30:00Z,04-10-21,04,10,21,21,30,Edmond,OK,Cylinder,4 minutes,"12 Fireballs and one cylinder shaped craft  above Edmond, OK on Saturday, April 10, 2021 between 9:30 pm and 10:00 pm",http://www.nuforc.org/webreports/162/S162933.html
430,04-10-21T21:00:00Z,04-10-21,04,10,21,21,00,Fairfax,VT,Flash,minutes,Five red flashing lights in the sky in a configuration over NW Vermont.,http://www.nuforc.org/webreports/162/S162722.html
431,04-10-21T21:00:00Z,04-10-21,04,10,21,21,00,Zephyr Hills,FL,Sphere,1 hour,Object at first was a blue star flashing that caught my attention. So I heald my camera up and took pics. After I zoomed in on my pics,http://www.nuforc.org/webreports/162/S162709.html
432,04-10-21T21:00:00Z,04-10-21,04,10,21,21,00,Tumwater,WA,Circle,5 seconds,"Ball of light moved at high speed, down and then went straight up into the sky",http://www.nuforc.org/webreports/162/S162649.html
433,04-10-21T20:10:00Z,04-10-21,04,10,21,20,10,Bakersfield,CA,Sphere,3 minutes,"Floating orange lights that showed up, moved across the sky and disappeared within 3 minutes.",http://www.nuforc.org/webreports/162/S162653.html
434,04-10-21T20:09:00Z,04-10-21,04,10,21,20,09,Santa Margarita,CA,Disk,Don't know,A bright disk that was unmoving.,http://www.nuforc.org/webreports/162/S162683.html
435,04-10-21T19:00:00Z,04-10-21,04,10,21,19,00,Merseyside (UK/England),,Oval,3 seconds,"Mixed silver oval shape, sunlit reflexion centre right hits small cloud cover at speed and doesn't appear again!",http://www.nuforc.org/webreports/162/S162596.html
436,04-10-21T16:28:00Z,04-10-21,04,10,21,16,28,Spokane,WA,,,MADAR Node 37,http://www.nuforc.org/webreports/162/S162768.html
437,04-10-21T02:00:00Z,04-10-21,04,10,21,02,00,Moore,TX,Cigar,10-15 minutes,Thousands of different orbs in night sky to ground followed by object entering atmosphere & turning away as it slowed.2AM,http://www.nuforc.org/webreports/162/S162652.html
438,04-10-21T02:00:00Z,04-10-21,04,10,21,02,00,Moore,TX,Cigar,15 minutes,Hundreds of orbs then a UFO/METEOR TO BOOT!,http://www.nuforc.org/webreports/162/S162682.html
439,04-10-21T00:00:00Z,04-10-21,04,10,21,00,00,Portland,OR,Fireball,10 seconds,I happened to look up in the sky over Rocky Butte claim it for like 10 seconds eyeglass up there and there was coming down at the sky l,http://www.nuforc.org/webreports/162/S162725.html
440,04-09-21T23:00:00Z,04-09-21,04,09,21,23,00,Saint Leonard,MD,Sphere,3 minutes,Red/orange spheres flying across the sky and I have video,http://www.nuforc.org/webreports/162/S162598.html
441,04-09-21T21:00:00Z,04-09-21,04,09,21,21,00,Cayucos,CA,Light,10 seconds,"I was sitting at the pier on the beach having a bonfire. There was a group of 6 of us, the 2 of us that were sitting at the fire both s",http://www.nuforc.org/webreports/162/S162671.html
442,04-09-21T20:45:00Z,04-09-21,04,09,21,20,45,Vacaville,CA,Formation,10 seconds,I saw 5-7 orange/red lights in a V shaped formation fly directly over my head.  ((Possibly Starlink satellites??)),http://www.nuforc.org/webreports/162/S162703.html
443,04-09-21T20:30:00Z,04-09-21,04,09,21,20,30,Nyack,NY,Fireball,20 seconds,((NUFORC Note:  Witness provides no details about sighting.  PD)),http://www.nuforc.org/webreports/162/S162693.html
444,04-09-21T20:00:00Z,04-09-21,04,09,21,20,00,Ewing,KY,Other,30 seconds,Ambulance or UFO,http://www.nuforc.org/webreports/162/S162687.html
445,04-09-21T06:04:00Z,04-09-21,04,09,21,06,04,Santa Barbara,CA,,,MADAR Node 57,http://www.nuforc.org/webreports/162/S162766.html
446,04-09-21T01:00:00Z,04-09-21,04,09,21,01,00,Dingman Township,PA,Light,25 minutes,I think I saw a UFO.,http://www.nuforc.org/webreports/162/S162549.html
447,04-08-21T22:00:00Z,04-08-21,04,08,21,22,00,Bordentown,NJ,Cigar,15 minutes,Multiple flying objects at different heights but in same general area.  Some move throughout the sky but others seem to stay stationary,http://www.nuforc.org/webreports/162/S162557.html
448,04-08-21T21:18:00Z,04-08-21,04,08,21,21,18,Fresno,TX,Light,1 minutes,We were sitting outside in our backyard talking when the UFO appeared out of nowhere in the sky. It was ascending upwards. The UFO itse,http://www.nuforc.org/webreports/162/S162556.html
449,04-08-21T21:18:00Z,04-08-21,04,08,21,21,18,Fresno,TX,Light,1 minutes,UFO appeared out of nowhere in the sky. It was ascending upwards.  ((Starlink satellites???)),http://www.nuforc.org/webreports/162/S162552.html
450,04-08-21T20:53:00Z,04-08-21,04,08,21,20,53,Rochester,NY,Circle,.30,"Observed silent orange, round object cross the starlit sky.  Upon observation, I alerted my sister to record with her cell phone.  Ther",http://www.nuforc.org/webreports/162/S162559.html
451,04-08-21T20:30:00Z,04-08-21,04,08,21,20,30,Buffalo,NY,Circle,5 minutes,"Circular light moving and rotating, blinking lights along side of it",http://www.nuforc.org/webreports/162/S162554.html
452,04-08-21T08:35:00Z,04-08-21,04,08,21,08,35,Evans,GA,Cylinder,a few seconds,It looked like a long plane,http://www.nuforc.org/webreports/162/S162561.html
453,04-08-21T00:30:00Z,04-08-21,04,08,21,00,30,Ellington/Somers,CT,Light,5+,"Intensely bright white light steadily hovering in place–no other lights. Checked against tree to be sure not moving, it was not.  Watch",http://www.nuforc.org/webreports/162/S162562.html
454,04-08-21T00:15:00Z,04-08-21,04,08,21,00,15,Cape Elizabeth,ME,Formation,30-45 seconds,"5 white orbs seen moving south, spread out+ erratic movement.",http://www.nuforc.org/webreports/162/S162547.html
455,04-08-21T00:00:00Z,04-08-21,04,08,21,00,00,Fort Lauderdale,FL,Circle,40 minutes,"Silent, low-flying circular aircraft with green beams of light directed at two different people minutes apart, from different angles.",http://www.nuforc.org/webreports/162/S162553.html
456,04-07-21T21:20:00Z,04-07-21,04,07,21,21,20,Crum Lynne,PA,Formation,15 seconds,"12 nickle size yellow,orange, white lights by US 13 in Delaware county Pa",http://www.nuforc.org/webreports/162/S162568.html
457,04-07-21T21:18:00Z,04-07-21,04,07,21,21,18,Girard,OH,Light,3 minutes,Unexplainable Bright Light,http://www.nuforc.org/webreports/162/S162566.html
458,04-07-21T21:08:00Z,04-07-21,04,07,21,21,08,Midland,TX,,2 minutes,Lighted train flies across night sky.  ((Starlink satellites??)),http://www.nuforc.org/webreports/162/S162563.html
459,04-07-21T21:02:00Z,04-07-21,04,07,21,21,02,Nicoma Park,OK,Formation,45 seconds,UFO seen  in Oklahoma.  ((Starlink satellites??)),http://www.nuforc.org/webreports/162/S162572.html
460,04-07-21T21:02:00Z,04-07-21,04,07,21,21,02,Amarillo,TX,Other,2 minutes,A very long string of white lights appearing to be of the same enormous object configured in a line.  ((Starlink satellites??)),http://www.nuforc.org/webreports/162/S162565.html
461,04-07-21T21:00:00Z,04-07-21,04,07,21,21,00,Richardson,TX,Cylinder,30 seconds,Strange lights in cylindrical formation flying above and  low then disappeared,http://www.nuforc.org/webreports/162/S162576.html
462,04-07-21T20:58:00Z,04-07-21,04,07,21,20,58,Littleton,CO,Light,5 minutes,A fleet of lights that flew across sky. You could see them speed up to another and was unlike anything I have ever seen. At top of the,http://www.nuforc.org/webreports/163/S163086.html
463,04-07-21T20:50:00Z,04-07-21,04,07,21,20,50,San Antonio,TX,Light,8 seconds,Witnessed cluster or one large structure traveling from NW to SE over San Antonio Metro.  ((Starlink satellitess??)),http://www.nuforc.org/webreports/162/S162570.html
464,04-07-21T20:45:00Z,04-07-21,04,07,21,20,45,Prosper,TX,Cigar,15-20 seconds,((NUFORC Note:  Witness providess no information abot sighting.  PD)),http://www.nuforc.org/webreports/162/S162573.html
465,04-07-21T20:45:00Z,04-07-21,04,07,21,20,45,Prosper,TX,Cigar,15-20 seconds,((NUFORC Note:  Witness provides no information about sighting.  PD)),http://www.nuforc.org/webreports/162/S162571.html
466,04-07-21T17:42:00Z,04-07-21,04,07,21,17,42,Jamesport,NY,Other,3 seconds,Three Spheres connected by a tic tac shaped craft,http://www.nuforc.org/webreports/162/S162578.html
467,04-07-21T09:10:00Z,04-07-21,04,07,21,09,10,Tulsa,OK,Other,1 minute,I was outside on my porch when I saw a string of 50 lights or so crossing over the sky from the northeast.   ((Starlink satellites??)),http://www.nuforc.org/webreports/162/S162574.html
468,04-07-21T04:45:00Z,04-07-21,04,07,21,04,45,Seattle,WA,Other,20 seconds,Spotlight appeared on the ground and settled on me but as I escaped it disappeared.,http://www.nuforc.org/webreports/162/S162654.html
469,04-07-21T00:00:00Z,04-07-21,04,07,21,00,00,Palm Desert,CA,Circle,15 minutes,"April 7 2021 around midnight in area of East Palm desert California in northeast sky an object high up, circular with flashing lights s",http://www.nuforc.org/webreports/162/S162555.html
470,04-06-21T21:40:00Z,04-06-21,04,06,21,21,40,Aberdeen,MS,Formation,5 minutes,"8-10 lights in what seemed to be in a perfectly spaced formation, as they disappeared across the sky.",http://www.nuforc.org/webreports/163/S163034.html
471,04-06-21T21:00:00Z,04-06-21,04,06,21,21,00,Winter Park,FL,Triangle,10 minutes,"White lights in a triangle shape, shut off, erratic blinking colored lights appeared as it slowly moved from south to north for about 1",http://www.nuforc.org/webreports/162/S162582.html
472,04-06-21T21:00:00Z,04-06-21,04,06,21,21,00,Victoria,BC,Oval,8 minutes,Witnessed oval shaped light first appear as a shooting star from due south at 50 degrees above horizon heading north. Object changed di,http://www.nuforc.org/webreports/162/S162551.html
473,04-06-21T12:30:00Z,04-06-21,04,06,21,12,30,Wichita,KS,,,MADAR Node 123,http://www.nuforc.org/webreports/162/S162764.html
474,04-06-21T01:00:00Z,04-06-21,04,06,21,01,00,Surprise,AZ,Light,hours,The light has been moving erratically for weeks,http://www.nuforc.org/webreports/162/S162590.html
475,04-06-21T00:00:00Z,04-06-21,04,06,21,00,00,New Pekin,IN,Teardrop,30 seconds,5 large silver teardrop-shaped ufos flying away from where I was heading (In a car). Nothing happened to my car afterwards.,http://www.nuforc.org/webreports/162/S162584.html
476,04-05-21T23:00:00Z,04-05-21,04,05,21,23,00,Bend,OR,Sphere,5-8 minutes,Large bright light with smaller lights around.  No sound,http://www.nuforc.org/webreports/162/S162589.html
477,04-05-21T23:00:00Z,04-05-21,04,05,21,23,00,Sisters,OR,Sphere,10 minutes,It was over the Cascades and a round ship with sparks shooting from it and it was i/4 over the crest. No sound.  Lookes like a hologram,http://www.nuforc.org/webreports/162/S162581.html
478,04-05-21T21:37:00Z,04-05-21,04,05,21,21,37,Presidio,TX,,~ 1 min. max,"A bright, high altitude light--NOT an airliner--moving at constant speed and brightness, then disappearing at same apparent speed.",http://www.nuforc.org/webreports/163/S163237.html
479,04-05-21T20:51:00Z,04-05-21,04,05,21,20,51,Norwalk,CT,,,MADAR Node 103,http://www.nuforc.org/webreports/162/S162765.html
480,04-05-21T20:25:00Z,04-05-21,04,05,21,20,25,Lancaster,MA,Disk,1 minutes,There was a flying saucer with flashing lights hovering and the quickly disappeared,http://www.nuforc.org/webreports/162/S162594.html
481,04-05-21T20:22:00Z,04-05-21,04,05,21,20,22,Lancaster,MA,Unknown,1 minute,"Big saucer like figure floating with green blinking lights, just blipped into nothing",http://www.nuforc.org/webreports/162/S162593.html
482,04-05-21T19:00:00Z,04-05-21,04,05,21,19,00,Hudson,NC,Circle,5 minutes,Most amazing thing I have ever seen!!!,http://www.nuforc.org/webreports/162/S162585.html
483,04-05-21T00:30:00Z,04-05-21,04,05,21,00,30,Magna,UT,Disk,3 minutes,"Disk, Gray Metallic color.",http://www.nuforc.org/webreports/162/S162600.html
484,04-04-21T21:53:00Z,04-04-21,04,04,21,21,53,Quincy,IL,Sphere,5 minutes,Bright white round light moving slowly from west to east sky then disappeared.,http://www.nuforc.org/webreports/162/S162606.html
485,04-04-21T21:30:00Z,04-04-21,04,04,21,21,30,Eunice,LA,Cigar,6 seconds,It was seen coming out north north west heading south southwest and then turned and headed East southeast. The craft was bright blu,http://www.nuforc.org/webreports/162/S162603.html
486,04-04-21T21:12:00Z,04-04-21,04,04,21,21,12,Port Charlotte,FL,Chevron,20 seconds,Chevron shaped craft with mirrored exterior traveling from sw to new portion of sky 1000ft above ground. Completely silent.,http://www.nuforc.org/webreports/162/S162605.html
487,04-04-21T20:30:00Z,04-04-21,04,04,21,20,30,Gaston,SC,Triangle,30 minutes +,"triangular object with red, green and white rapidly flashing lights, apparently stationary, low in the westerly sky after sunset",http://www.nuforc.org/webreports/162/S162843.html
488,04-04-21T20:20:00Z,04-04-21,04,04,21,20,20,South Lake Tahoe,CA,Formation,4 minutes,Too round & bright to be a plane; it was quiet; moved slightly erractically; disappeared in a flash,http://www.nuforc.org/webreports/162/S162602.html
489,04-04-21T20:15:00Z,04-04-21,04,04,21,20,15,Peoria,AZ,Light,4 minutes,"Bright craft light sighting in Peoria, AZ",http://www.nuforc.org/webreports/162/S162591.html
490,04-04-21T20:07:00Z,04-04-21,04,04,21,20,07,Longwood,FL,Other,~3 minutes,"Round reflective object flying slowly East to West over Longwood, FL at sunset",http://www.nuforc.org/webreports/162/S162595.html
491,04-04-21T18:35:00Z,04-04-21,04,04,21,18,35,Melbourne (Australia),,Circle,5 minutes,I saw a black steady object in the sky at approx 18:35. It stayed really steady for a few minutes before moving in the sky and disappea,http://www.nuforc.org/webreports/162/S162610.html
492,04-04-21T02:50:00Z,04-04-21,04,04,21,02,50,Center Conway,NH,Light,5 minutes,Two distant lights suddenly move in formation.,http://www.nuforc.org/webreports/163/S163104.html
