,event_time,event_date,year,month,day,hour,minute,city,state,shape,duration,summary,event_url
240,05-02-21T20:45:00Z,05-02-21,05,02,21,20,45,Westport,CT,Unknown,30 seconds,Unusual path and abrupt changes of direction by a star-like object in the sky,http://www.nuforc.org/webreports/163/S163107.html
241,05-02-21T11:00:00Z,05-02-21,05,02,21,11,00,Colorado Springs,CO,Sphere,10-15 seconds,7 white objects fly across blue sky and then disappeared,http://www.nuforc.org/webreports/162/S162910.html
242,05-02-21T06:30:00Z,05-02-21,05,02,21,06,30,Seattle,WA,Circle,15 minutes,Circle objest hovering in the clouds above flight path.,http://www.nuforc.org/webreports/162/S162915.html
243,05-02-21T05:00:00Z,05-02-21,05,02,21,05,00,Atlanta,GA,Fireball,2 hours,Ring Door Bell Recording UFO disappearing,http://www.nuforc.org/webreports/163/S163079.html
244,05-02-21T04:00:00Z,05-02-21,05,02,21,04,00,Claremore,OK,Triangle,3 seconds,"Large triangular object with soft points, light blue edges and black towards the center. It was moving incredibly fast. It was moderate",http://www.nuforc.org/webreports/162/S162926.html
245,05-01-21T23:00:00Z,05-01-21,05,01,21,23,00,Burkesville,KY,Oval,5 minutes,Was over cumberland river near bridge and flew over house on south side bluetooth radio and lights outside started to blink radio made,http://www.nuforc.org/webreports/162/S162925.html
246,05-01-21T22:00:00Z,05-01-21,05,01,21,22,00,Massapequa Park,NY,Fireball,20 seconds,Fireball shape moving very fast through the sky. Did not have any sound. Seen moving in a straight line for about 20 seconds before dis,http://www.nuforc.org/webreports/162/S162920.html
247,05-01-21T21:00:00Z,05-01-21,05,01,21,21,00,Hartsel,CO,Light,2 hours,Dancing red lights above elkhorn basin.,http://www.nuforc.org/webreports/162/S162902.html
248,05-01-21T21:00:00Z,05-01-21,05,01,21,21,00,Crest Hill,IL,Light,10 seconds,bright object moving southeast to northwest,http://www.nuforc.org/webreports/162/S162923.html
249,05-01-21T20:56:00Z,05-01-21,05,01,21,20,56,Grand Junction,CO,,,MADAR Node 75,http://www.nuforc.org/webreports/163/S163301.html
250,05-01-21T20:00:00Z,05-01-21,05,01,21,20,00,Fond du Lac,WI,Circle,7 seconds,black/dark gray circular object comes out of the clouds before disappearing back into them,http://www.nuforc.org/webreports/162/S162912.html
251,05-01-21T20:00:00Z,05-01-21,05,01,21,20,00,Fond du Lac,WI,Circle,10 seconds,dark circular object comes out of the clouds before disappearing back into them,http://www.nuforc.org/webreports/162/S162913.html
252,05-01-21T18:20:00Z,05-01-21,05,01,21,18,20,Chicago,IL,Formation,20 seconds,My wife and I were sitting on the grass in the park overlooking the water of Lake Michigan at Montrose Harbor facing East. The sky was,http://www.nuforc.org/webreports/162/S162911.html
253,05-01-21T18:20:00Z,05-01-21,05,01,21,18,20,Valley City,ND,,,MADAR Node 93,http://www.nuforc.org/webreports/163/S163299.html
254,05-01-21T18:00:00Z,05-01-21,05,01,21,18,00,Fredericksburg,VA,Circle,5 minutes,Large group of small circular objects,http://www.nuforc.org/webreports/162/S162903.html
255,05-01-21T16:35:00Z,05-01-21,05,01,21,16,35,Glens Falls,NY,Triangle,10-15 minutes,Triangular object glens falls,http://www.nuforc.org/webreports/162/S162921.html
256,05-01-21T12:45:00Z,05-01-21,05,01,21,12,45,West Hollywood,CA,Egg,10 minutes,UFO sighting from West Hollywood looking NE,http://www.nuforc.org/webreports/162/S162922.html
257,05-01-21T08:45:00Z,05-01-21,05,01,21,08,45,Vero Beach,FL,Other,20 minutes,Metal object in daylight sky very slow moving,http://www.nuforc.org/webreports/162/S162894.html
258,04-30-21T23:15:00Z,04-30-21,04,30,21,23,15,Brights Grove (Canada),ON,Oval,30 seconds,Transparent fish like object  sucking power from power line and going across truck windshield. And becomes a bright ball of ...,http://www.nuforc.org/webreports/163/S163103.html
259,04-30-21T21:00:00Z,04-30-21,04,30,21,21,00,Newton,IA,Circle,5 seconds,it was northeast direction saw a bright circle shape move slow then disappear very quickly,http://www.nuforc.org/webreports/162/S162943.html
260,04-30-21T20:45:00Z,04-30-21,04,30,21,20,45,Jellico,TN,Other,15 seconds,I was out flying a drone in the field and heard this rumbling but not very loud but started feeling the rumbling more than heard looked,http://www.nuforc.org/webreports/162/S162917.html
261,04-30-21T19:42:00Z,04-30-21,04,30,21,19,42,Cottonwood,AZ,Light,3 days in a row about 1 m,The past 3 nights my husband and I have seen between an orange to a red glow light that appears moving erratically then disappears and,http://www.nuforc.org/webreports/162/S162927.html
262,04-30-21T00:45:00Z,04-30-21,04,30,21,00,45,Fairfield,OH,Fireball,5 seconds,"Green flash, streak, fireball.",http://www.nuforc.org/webreports/162/S162890.html
263,04-30-21T00:00:00Z,04-30-21,04,30,21,00,00,Oak Hill,WV,Circle,10 minutes,"A little after midnight at a resort in WV. Was outside in a hot tub relaxing. Had 3 beers 1 had a drink koozie around it, the one I was",http://www.nuforc.org/webreports/162/S162941.html
264,04-29-21T23:59:00Z,04-29-21,04,29,21,23,59,Oswego,NY,Rectangle,5 minutes,Flashing red lights and white objects,http://www.nuforc.org/webreports/162/S162891.html
265,04-29-21T23:39:00Z,04-29-21,04,29,21,23,39,Homosassa,FL,Fireball,5 minutes,I was sitting outside looking to the east and homosassa Florida I saw a hot pink streak and as I watched it go across the sky it turned,http://www.nuforc.org/webreports/162/S162878.html
266,04-29-21T22:45:00Z,04-29-21,04,29,21,22,45,Corydon,IN,Oval,10 minutes,"Sighting: Date: 	April 29, 2021 Location: Corydon, Indiana Time: Approx. 10:45PM Weather: Partly cloudy with rain Visual observers: 2 D",http://www.nuforc.org/webreports/163/S163219.html
267,04-29-21T22:00:00Z,04-29-21,04,29,21,22,00,Aragonite,UT,Disk,10 seconds,Black disc with blue dotted flashing lights hovering near our car on interstate 80,http://www.nuforc.org/webreports/162/S162895.html
268,04-29-21T22:00:00Z,04-29-21,04,29,21,22,00,Flagstaff,AZ,Sphere,10 seconds,"Super bright yellow object... Pointed it out to my friend, me and him were staring at it and it instantly disappeared",http://www.nuforc.org/webreports/162/S162897.html
269,04-29-21T21:03:00Z,04-29-21,04,29,21,21,03,Carson City,NV,Circle,8 minutes,Bright counter-clock spinning,http://www.nuforc.org/webreports/163/S163205.html
270,04-29-21T13:58:00Z,04-29-21,04,29,21,13,58,St. Louis,MO,,,MADAR Node 70,http://www.nuforc.org/webreports/163/S163303.html
271,04-29-21T09:32:00Z,04-29-21,04,29,21,09,32,Kansas City,MO,,,MADAR Node 40,http://www.nuforc.org/webreports/163/S163306.html
272,04-28-21T23:46:00Z,04-28-21,04,28,21,23,46,Kissimmee,FL,Fireball,3 minutes,We saw what looked like a huge fireball in the sky. It looked very different than a falling star. It was a falling fireball. And then t,http://www.nuforc.org/webreports/162/S162879.html
273,04-28-21T21:50:00Z,04-28-21,04,28,21,21,50,Carson City,NV,Circle,10 minutes,Ufo staying still spinning,http://www.nuforc.org/webreports/162/S162884.html
274,04-28-21T21:40:00Z,04-28-21,04,28,21,21,40,Yardley,PA,Unknown,5 minutes,"Red flickering lights in Bucks County, PA",http://www.nuforc.org/webreports/162/S162893.html
275,04-27-21T20:15:00Z,04-27-21,04,27,21,20,15,Everett,WA,Light,15 minutes,Triangle formation of twinkling lights,http://www.nuforc.org/webreports/162/S162885.html
276,04-27-21T18:42:00Z,04-27-21,04,27,21,18,42,Armadale,,Flash,1 second,"This happened twice, I thought it was the shuttle to the ISS, but it happened again. The trajectory movement is North East, two nights",http://www.nuforc.org/webreports/162/S162858.html
277,04-27-21T17:26:00Z,04-27-21,04,27,21,17,26,Palmdale,CA,Oval,1 minute,I was sitting having dinner at the dining table and I was looking out the sliding glass door when I noticed this dark object. I watched,http://www.nuforc.org/webreports/162/S162872.html
278,04-27-21T15:31:00Z,04-27-21,04,27,21,15,31,South Portland,ME,Other,5 minutes,My husband saw a sparkle in the sky and thought it was a balloon.  I thought it was too high up and big to be a balloon so I grabbed my,http://www.nuforc.org/webreports/162/S162875.html
279,04-27-21T13:06:00Z,04-27-21,04,27,21,13,06,Hanover,MD,,,MADAR Node 77,http://www.nuforc.org/webreports/163/S163300.html
280,04-27-21T11:19:00Z,04-27-21,04,27,21,11,19,St. Louis,MO,,,MADAR Node 70,http://www.nuforc.org/webreports/163/S163304.html
281,04-27-21T10:22:00Z,04-27-21,04,27,21,10,22,Gulf Shores,AL,Sphere,10 minutes,Flashing white light hovering near an airport before jetting away at well over 1000 miles an hour without sound.,http://www.nuforc.org/webreports/162/S162874.html
282,04-27-21T09:20:00Z,04-27-21,04,27,21,09,20,Douglas,WY,Light,20 seconds,"First I would like to say I don't want anyone to think I am crazy. This is not a hoax or a joke, I just want some answers and to know t",http://www.nuforc.org/webreports/162/S162901.html
283,04-27-21T07:00:00Z,04-27-21,04,27,21,07,00,Tallahassee,FL,Unknown,10 minutes,"I arrived at work and I parked my car in front of the building. The sky was clear without clouds. As I was walking, I looked into the s",http://www.nuforc.org/webreports/162/S162873.html
284,04-27-21T04:40:00Z,04-27-21,04,27,21,04,40,Bladenboro,NC,Light,Minutes,35-30 bright &quot;stars&quot; traveling the same speed and equal distances apart,http://www.nuforc.org/webreports/162/S162853.html
285,04-27-21T04:00:00Z,04-27-21,04,27,21,04,00,Okemos,MI,Triangle,1 minute,"On the morning of April 27th, 2021 I was sitting outside smoking cigarettes under my deck at approximately 4:00 in the morning near Eas",http://www.nuforc.org/webreports/162/S162944.html
286,04-26-21T23:00:00Z,04-26-21,04,26,21,23,00,Reading,PA,Triangle,20 minutes,"Stable in one spot in sky! Looked through binoculars and saw triangle shape with red, green and white lights turning off and on with ci",http://www.nuforc.org/webreports/162/S162863.html
287,04-26-21T22:00:00Z,04-26-21,04,26,21,22,00,Res Moines,IA,Other,1 minute,"I was in my front yard looking at the Super Pink Moon with my neighbor in the evening on the eveningof April 26th, 2021. We were both u",http://www.nuforc.org/webreports/162/S162877.html
288,04-26-21T21:25:00Z,04-26-21,04,26,21,21,25,Cleveland,TX,Oval,15 seconds,Something astounding in the skies of southeast Texas....,http://www.nuforc.org/webreports/162/S162869.html
289,04-26-21T19:29:00Z,04-26-21,04,26,21,19,29,Houston,TX,Unknown,<5 seconds,Flashing an Streaking object near the moon,http://www.nuforc.org/webreports/162/S162916.html
290,04-26-21T17:44:00Z,04-26-21,04,26,21,17,44,Edmonds,WA,,,MADAR Node 61,http://www.nuforc.org/webreports/163/S163305.html
291,04-26-21T06:21:00Z,04-26-21,04,26,21,06,21,Fort Myers,FL,Other,~2 minutes,"Fast moving light seen in early morning sky of Fort myers, Florida.",http://www.nuforc.org/webreports/162/S162850.html
292,04-26-21T03:00:00Z,04-26-21,04,26,21,03,00,Lubbock,TX,Unknown,15 minutes,Bright white beam shot towards me while floating white lit craft hovers 2 and a half feet above back yard.,http://www.nuforc.org/webreports/162/S162871.html
293,04-26-21T00:30:00Z,04-26-21,04,26,21,00,30,New Britain,CT,Unknown,3 seconds,Chrome blue light moving quickly and curving from northwest to dew north.,http://www.nuforc.org/webreports/162/S162852.html
294,04-26-21T00:30:00Z,04-26-21,04,26,21,00,30,Calgary,AB,Circle,Minute,"Erratically fast moving white star like craft, dimmed down and vanished",http://www.nuforc.org/webreports/162/S162854.html
295,04-26-21T00:00:00Z,04-26-21,04,26,21,00,00,easley,SC,Triangle,5 minutes,"I have never made one of these reports and I am reluctant to make this one.  I am prior USAF SSGT, Retire after 23 years of government",http://www.nuforc.org/webreports/162/S162859.html
296,04-25-21T22:00:00Z,04-25-21,04,25,21,22,00,North Charleston (Folly Beach),SC,Changing,,3 lights in a triangle formations changes shapes and 1 light vanishes,http://www.nuforc.org/webreports/162/S162848.html
297,04-25-21T19:05:00Z,04-25-21,04,25,21,19,05,Show Low,AZ,,,MADAR Node 74,http://www.nuforc.org/webreports/163/S163302.html
298,04-25-21T17:00:00Z,04-25-21,04,25,21,17,00,Hot Springs,AR,Triangle,2 minutes,We saw what looked like a big triangle shaped mirror and I'm assuming you could only see it when the light was shining on it right beca,http://www.nuforc.org/webreports/162/S162846.html
299,04-25-21T12:54:00Z,04-25-21,04,25,21,12,54,Swayze,IN,,,MADAR Node 22,http://www.nuforc.org/webreports/163/S163307.html
300,04-25-21T10:15:00Z,04-25-21,04,25,21,10,15,Gainesville,GA,Sphere,25 minutes,Twinkling lights ball. Stationary in sky before slowly moving away,http://www.nuforc.org/webreports/162/S162845.html
301,04-25-21T05:38:00Z,04-25-21,04,25,21,05,38,Santa Claus,IN,,,MADAR Node 114,http://www.nuforc.org/webreports/163/S163117.html
302,04-24-21T22:00:00Z,04-24-21,04,24,21,22,00,Phoenix,AZ,Sphere,8 minutes,6 objects. Round. Bright as full moon. Size of seeing venus but larger. Moving west to east. 4 in a diamond formation with two followin,http://www.nuforc.org/webreports/162/S162844.html
303,04-23-21T23:36:00Z,04-23-21,04,23,21,23,36,Watauga,TX,Fireball,2 minutes,"Large, Silent, Fireball-like Objects Crossing over Field",http://www.nuforc.org/webreports/162/S162832.html
304,04-23-21T21:00:00Z,04-23-21,04,23,21,21,00,Candler,NC,Oval,15 minutes,Watched 3 separate ufos lift up and take off,http://www.nuforc.org/webreports/162/S162837.html
305,04-23-21T20:55:00Z,04-23-21,04,23,21,20,55,Branford,CT,Fireball,2 minutes,"Bright orange fireball moving slow speed over trees, hovering and disappearing. Second encounter recorded, clear sky and moonlight.",http://www.nuforc.org/webreports/162/S162841.html
306,04-23-21T20:30:00Z,04-23-21,04,23,21,20,30,Gresham,OR,Circle,5 minutes,2 circular aerial objects observed over Gresham Oregon 4/23/21,http://www.nuforc.org/webreports/162/S162833.html
307,04-23-21T06:30:00Z,04-23-21,04,23,21,06,30,Blackshear,GA,Circle,9 minutes,Very strange   ((NUFORC Note:  Rocket launch from Cape Canaveral.  PD)),http://www.nuforc.org/webreports/162/S162815.html
308,04-23-21T06:00:00Z,04-23-21,04,23,21,06,00,Vero Beach,FL,Light,5 minutes,I was driving and saw something strange in the sky.   ((NUFORC Note:  Rocket launch from Cape Canaveral.  PD)),http://www.nuforc.org/webreports/162/S162822.html
309,04-23-21T06:00:00Z,04-23-21,04,23,21,06,00,Mechanicsville,VA,Circle,Seconds,Ball in the sky   ((NUFORC Note:  Rocket launch from Cape Canaveral.  PD)),http://www.nuforc.org/webreports/162/S162814.html
310,04-23-21T05:59:00Z,04-23-21,04,23,21,05,59,St. Augustine,FL,Light,3 minutes,"2 extremely bright lights appeared over east coast nearly simultaneously. One appeared to catch fire and fall towards ocean, second app",http://www.nuforc.org/webreports/162/S162824.html
311,04-23-21T05:58:00Z,04-23-21,04,23,21,05,58,Durham,NC,Cone,>5 minutes,A cone of light coming from the sky unlike anything I have ever seen.   ((NUFORC Note:  Rocket launch from Cape Canaveral.  PD)),http://www.nuforc.org/webreports/162/S162819.html
312,04-23-21T05:55:00Z,04-23-21,04,23,21,05,55,I-16 south,GA,Sphere,10 minutes,Noticed a intense light that was covering a large area in the sky.  ((NUFORC Note:  Rocket launch from Cape Canaveral.  PD)),http://www.nuforc.org/webreports/162/S162823.html
313,04-23-21T05:54:00Z,04-23-21,04,23,21,05,54,Parrish,FL,Light,5 minutes,Two bright lights one flashing with a descending expanding ring.   ((NUFORC Note:  Rocket launch from Cape Canaveral.  PD)),http://www.nuforc.org/webreports/162/S162820.html
314,04-23-21T05:45:00Z,04-23-21,04,23,21,05,45,Belleview,FL,Diamond,15-20 minutes, ((NUFORC Note:  Rocket launch from Cape Canaveral.  PD)),http://www.nuforc.org/webreports/162/S162821.html
315,04-23-21T05:45:00Z,04-23-21,04,23,21,05,45,Champions Gate,FL,Light,~10-15 minutes,Im former military and have never seen aircraft do that.  ((NUFORC Note:  Rocket launch from Cape Canaveral.  PD)),http://www.nuforc.org/webreports/162/S162826.html
316,04-23-21T05:40:00Z,04-23-21,04,23,21,05,40,Athens,GA,Light,10 minutes,Saw a very bright large light moving fairly low and slowly across the Eastern sky.   The light was shining in one direction while movin,http://www.nuforc.org/webreports/162/S162849.html
317,04-23-21T05:30:00Z,04-23-21,04,23,21,05,30,Hinesville,GA,Triangle,20 minutes,Object was on slow descent towards fort Stewart Georgia object was triangle shape likely turned sideways with bright light protruding f,http://www.nuforc.org/webreports/162/S162931.html
318,04-23-21T05:30:00Z,04-23-21,04,23,21,05,30,Hinesville,GA,Triangle,20 minutes,Object was on slow descent towards fort Stewart Georgia object was triangle shape slightly turned sideways with bright light protruding,http://www.nuforc.org/webreports/162/S162930.html
319,04-23-21T03:07:00Z,04-23-21,04,23,21,03,07,Mountlake Terrace,WA,,,MADAR Node 100,http://www.nuforc.org/webreports/163/S163118.html
320,04-23-21T03:00:00Z,04-23-21,04,23,21,03,00,Tampa,FL,Light,1 minute,((name deleted)),http://www.nuforc.org/webreports/162/S162836.html
321,04-23-21T02:40:00Z,04-23-21,04,23,21,02,40,Firestone,CO,Chevron,3-4 seconds,"I witnessed a chevron-shaped object, silent and with seven lights cross my line of sight between 02:35am to 02:40am on Friday, April 23",http://www.nuforc.org/webreports/162/S162827.html
322,04-23-21T01:40:00Z,04-23-21,04,23,21,01,40,Star Valley,AZ,,,MADAR Node 53,http://www.nuforc.org/webreports/163/S163127.html
323,04-22-21T22:23:00Z,04-22-21,04,22,21,22,23,New York City (Brooklyn),NY,Fireball,2 minutes,Saw a steady pulsating fireball above that moved slowly away,http://www.nuforc.org/webreports/162/S162818.html
324,04-22-21T21:00:00Z,04-22-21,04,22,21,21,00,Firozabad (India),,Changing,6 minutes,Boomerang like shaped with five lights made a speed big heart like path and suddenly distriduted and vanished,http://www.nuforc.org/webreports/162/S162804.html
325,04-22-21T20:50:00Z,04-22-21,04,22,21,20,50,Appleton,WI,Triangle,20+ minutes,Metallic triangular shaped object appearing to tumble in the sky.,http://www.nuforc.org/webreports/162/S162829.html
326,04-22-21T20:42:00Z,04-22-21,04,22,21,20,42,Dallas,GA,Light,45 seconds,"12 red lights in the sky low to the horizon in Paulding County, GA.",http://www.nuforc.org/webreports/162/S162817.html
327,04-22-21T16:58:00Z,04-22-21,04,22,21,16,58,Kingman,AZ,Disk,7 seconds,Small silver/white disk shaped object traveling in excess of 2-300 mph south of Kingman AZ,http://www.nuforc.org/webreports/163/S163196.html
328,04-22-21T11:56:00Z,04-22-21,04,22,21,11,56,Crooked River Ranch,OR,Light,90 seconds,Lights high speed one catching other then turning left.  Covered full sky horizon in 90 seconds.,http://www.nuforc.org/webreports/162/S162830.html
329,04-22-21T10:01:00Z,04-22-21,04,22,21,10,01,Pine City,NY,,,MADAR Node 82,http://www.nuforc.org/webreports/163/S163121.html
330,04-22-21T10:00:00Z,04-22-21,04,22,21,10,00,Surprise,AZ,Egg,1 hour,I can go or send anyone at anytime to this area and they will get proof because I believe this is a base and if anyone observes then su,http://www.nuforc.org/webreports/162/S162906.html
331,04-22-21T05:32:00Z,04-22-21,04,22,21,05,32,Springfield,MO,,,MADAR Node 36,http://www.nuforc.org/webreports/163/S163132.html
332,04-22-21T03:35:00Z,04-22-21,04,22,21,03,35,Lacey,WA,,,MADAR Node 50,http://www.nuforc.org/webreports/163/S163130.html
333,04-22-21T03:35:00Z,04-22-21,04,22,21,03,35,Lacey,WA,,,MADAR Node 50,http://www.nuforc.org/webreports/163/S163128.html
334,04-22-21T03:35:00Z,04-22-21,04,22,21,03,35,Lacey,WA,,,MADAR Node 50,http://www.nuforc.org/webreports/163/S163129.html
335,04-22-21T00:00:00Z,04-22-21,04,22,21,00,00,Oregon City,OR,Triangle,3-5 minutes,"A bright triangular shape hovering in sky observed from Redland Oregon, perhaps hovering over Beavercreek area. It hovered for awhile a",http://www.nuforc.org/webreports/162/S162811.html
336,04-21-21T21:30:00Z,04-21-21,04,21,21,21,30,Grandview Heights,OH,Light,,Strange lights hovering low over Columbus.  ((NUFOC Note:  Possible twinkling star??  PD)),http://www.nuforc.org/webreports/162/S162802.html
337,04-21-21T21:25:00Z,04-21-21,04,21,21,21,25,Eatonton,GA,Light,15 seconds,"For several months my husband and I watched a strange light not moving in the sky, then he didn't see it for awhile.  Last night it was",http://www.nuforc.org/webreports/162/S162801.html
338,04-21-21T17:00:00Z,04-21-21,04,21,21,17,00,Woodbridge,NJ,Unknown,Few minutes,UFO reported in central NJ affecting power/electrical,http://www.nuforc.org/webreports/162/S162813.html
339,04-21-21T10:57:00Z,04-21-21,04,21,21,10,57,Keene,NH,,,MADAR Node 27,http://www.nuforc.org/webreports/163/S163134.html
340,04-21-21T07:24:00Z,04-21-21,04,21,21,07,24,Northbrook,IL,,,MADAR Node 98,http://www.nuforc.org/webreports/163/S163120.html
341,04-21-21T05:31:00Z,04-21-21,04,21,21,05,31,Franklin,KY,,,MADAR Node 54,http://www.nuforc.org/webreports/163/S163126.html
342,04-21-21T04:47:00Z,04-21-21,04,21,21,04,47,Erie,PA,,,MADAR Node 39,http://www.nuforc.org/webreports/163/S163131.html
343,04-21-21T04:30:00Z,04-21-21,04,21,21,04,30,Payson,AZ,Light,10 minutes,Bright light moving slowly across the sky,http://www.nuforc.org/webreports/162/S162791.html
344,04-20-21T23:43:00Z,04-20-21,04,20,21,23,43,Brier,WA,Oval,15 minutes,"Oval shaped, grey, hovering, no sound, fast ship.",http://www.nuforc.org/webreports/162/S162816.html
345,04-20-21T23:00:00Z,04-20-21,04,20,21,23,00,Bridgton,ME,Light,10 minutes,"I was outside at midnight on April 20th 2021 when I saw what I think was multiple UFOS. I was out in the backyard in Bridgton Maine, wh",http://www.nuforc.org/webreports/162/S162799.html
346,04-20-21T21:48:00Z,04-20-21,04,20,21,21,48,Minneapolis,MN,Sphere,4 seconds,Bright white sphere briefly materialized over Minneapolis.,http://www.nuforc.org/webreports/162/S162793.html
347,04-20-21T21:30:00Z,04-20-21,04,20,21,21,30,Hartford,CT,Formation,1 minute,3 red bright light dots in line then form a triangle form and disappear in the sky,http://www.nuforc.org/webreports/162/S162796.html
348,04-20-21T21:00:00Z,04-20-21,04,20,21,21,00,Dublin,PA,Fireball,1-2 minutes,"Ball of light fastly flashes/transport into a triangle, if they were 3 lighting up in triangle formation 1 blink per point at 1 time. A",http://www.nuforc.org/webreports/162/S162777.html
349,04-20-21T20:30:00Z,04-20-21,04,20,21,20,30,New York City (Brooklyn),NY,Flash,3:39 minutes,"At approximately 8:30pm eastern time, I noticed a 1 pulsating light that was stationary in the western sky facing east. As I approached",http://www.nuforc.org/webreports/162/S162797.html
350,04-20-21T15:25:00Z,04-20-21,04,20,21,15,25,Pine City,NY,,,MADAR Node 82,http://www.nuforc.org/webreports/163/S163122.html
351,04-20-21T11:09:00Z,04-20-21,04,20,21,11,09,St. Louis,MO,,,MADAR Node 70,http://www.nuforc.org/webreports/163/S163123.html
352,04-20-21T06:02:00Z,04-20-21,04,20,21,06,02,San Mateo,CA,Light,12 seconds,420 morning zig zag white light,http://www.nuforc.org/webreports/162/S162794.html
353,04-20-21T04:52:00Z,04-20-21,04,20,21,04,52,Mountlake Terrace,WA,,,MADAR Node 100,http://www.nuforc.org/webreports/163/S163119.html
354,04-19-21T22:00:00Z,04-19-21,04,19,21,22,00,Glen Oaks,NY,Light,2 minutes,Red pulsating orb low in sky over LIE,http://www.nuforc.org/webreports/162/S162750.html
355,04-19-21T21:29:00Z,04-19-21,04,19,21,21,29,Tulare,CA,Fireball,21:32,I saw three unknown flying objects.,http://www.nuforc.org/webreports/162/S162798.html
356,04-19-21T20:30:00Z,04-19-21,04,19,21,20,30,West Chester,,Cigar,10 minutes,"Crazy cigar shaped glowing object in suburban PA.  It glowed and hovered for at least 10 minutes, my dog was very disturbed.",http://www.nuforc.org/webreports/162/S162785.html
357,04-19-21T20:12:00Z,04-19-21,04,19,21,20,12,Buffalo,NY,,,MADAR Node 163,http://www.nuforc.org/webreports/163/S163115.html
358,04-19-21T20:04:00Z,04-19-21,04,19,21,20,04,Edmonds,WA,,,MADAR Node 61,http://www.nuforc.org/webreports/163/S163125.html
359,04-19-21T16:51:00Z,04-19-21,04,19,21,16,51,Indianapolis,IN,,,MADAR Node 21,http://www.nuforc.org/webreports/163/S163137.html
360,04-19-21T15:29:00Z,04-19-21,04,19,21,15,29,Albuquerque,NM,,,MADAR Node 23,http://www.nuforc.org/webreports/163/S163136.html
361,04-19-21T14:49:00Z,04-19-21,04,19,21,14,49,Marietta,GA,Circle,1 minute,Saw a large circular stationary object in broad daylight .  It was a dark color and no sound,http://www.nuforc.org/webreports/162/S162769.html
362,04-19-21T14:32:00Z,04-19-21,04,19,21,14,32,Lees Summit,MO,,,MADAR Node 24,http://www.nuforc.org/webreports/163/S163135.html
363,04-19-21T00:45:00Z,04-19-21,04,19,21,00,45,Clarion,PA,Light,30,3 lights over the midnight sky,http://www.nuforc.org/webreports/162/S162770.html
364,04-19-21T00:25:00Z,04-19-21,04,19,21,00,25,Estes Park,CO,,,MADAR Node 156,http://www.nuforc.org/webreports/163/S163116.html
365,04-18-21T22:15:00Z,04-18-21,04,18,21,22,15,Lafayette,CO,Light,30 minutes,A brighly flashing multi-colored light in the night sky over Colorado viewed for a half hour.  ((NUFORC Note:  Sirius??  PD)),http://www.nuforc.org/webreports/162/S162771.html
366,04-18-21T22:05:00Z,04-18-21,04,18,21,22,05,Spanish Valley,UT,Light,5 minutes,"Blue flickering light, small quick movements over Spanish Valley, UT",http://www.nuforc.org/webreports/162/S162792.html
367,04-18-21T21:30:00Z,04-18-21,04,18,21,21,30,Santa Fe,TX,Sphere,15-20 minutes,Green orb making irregular movements in the sky,http://www.nuforc.org/webreports/162/S162899.html
368,04-18-21T21:08:00Z,04-18-21,04,18,21,21,08,Nanaimo (Canada),BC,Light,15 seconds,Distant Satellite -Erratic Flight Path,http://www.nuforc.org/webreports/162/S162779.html
369,04-18-21T20:00:00Z,04-18-21,04,18,21,20,00,Riverdale,UT,Formation,1 hour,"My husband and I were UFO hunting from our yard on the nights of April 17 and 18, we were using 15x70 Celestron binoculars.  On the nig",http://www.nuforc.org/webreports/162/S162780.html
