,event_time,event_date,year,month,day,hour,minute,city,state,shape,duration,summary,event_url
0,05-19-21T20:15:00Z,05-19-21,05,19,21,20,15,Atlanta,GA,Sphere,10 min,Two black UFO over Atlanta one coming close to jet plane.,http://www.nuforc.org/webreports/163/S163297.html
1,05-19-21T17:25:00Z,05-19-21,05,19,21,17,25,Glens Falls,NY,Triangle,20 minutes,Triangular object over the Hudson River,http://www.nuforc.org/webreports/163/S163285.html
2,05-19-21T14:30:00Z,05-19-21,05,19,21,14,30,North Haledon,NJ,Other,20 mins,I’m no stranger to flying things but yesterday was very interestingly unusual. Attached is a drawing and that’s how close it was I coul,http://www.nuforc.org/webreports/163/S163291.html
3,05-19-21T10:50:00Z,05-19-21,05,19,21,10,50,Clarksburg,MD,Triangle,1 min,Triangle ufo,http://www.nuforc.org/webreports/163/S163298.html
4,05-19-21T01:00:00Z,05-19-21,05,19,21,01,00,Sharon Connecticut,CT,Light,1 hour,Strange star over northwestern connecticut,http://www.nuforc.org/webreports/163/S163274.html
5,05-19-21T00:23:00Z,05-19-21,05,19,21,00,23,Rosamond,CA,Formation,1 minute,Large Orange cluster of orbs,http://www.nuforc.org/webreports/163/S163273.html
6,05-18-21T00:00:00Z,05-18-21,05,18,21,00,00,Corvallis,OR,Cigar,20 seconds,"Saw cigar shaped whitish/blue object with pulsing white and blue lights in sky near home depot in Corvallis, Oregon",http://www.nuforc.org/webreports/163/S163278.html
7,05-18-21T21:25:00Z,05-18-21,05,18,21,21,25,Colton,CA,Circle,15 seconds,Bright light in the sky vanishes in seconds,http://www.nuforc.org/webreports/163/S163277.html
8,05-18-21T12:00:00Z,05-18-21,05,18,21,12,00,Lewisburg,PA,Other,All night/every night,This has been going on at my residence for the last several months. I’ve contacted the commonwealth as there’s a federal prison behind,http://www.nuforc.org/webreports/163/S163272.html
9,05-18-21T11:30:00Z,05-18-21,05,18,21,11,30,Paso Robles,CA,Sphere,5-10 seconds,"White ball traveling at very high speed, observed on clear sunny day.",http://www.nuforc.org/webreports/163/S163262.html
10,05-18-21T07:40:00Z,05-18-21,05,18,21,07,40,Perth (Australia),,Disk,5 minutes,I saw three circular shaped massive UFO's floating above my forming a triangle formation. They had flashing lights on the bottom of the,http://www.nuforc.org/webreports/163/S163244.html
11,05-18-21T04:00:00Z,05-18-21,05,18,21,04,00,Warwick,NY,Unknown,2:00,"Four blinking lights hovering without making a sound for at least 3 minutes in Orange County, NY",http://www.nuforc.org/webreports/163/S163280.html
12,05-18-21T02:00:00Z,05-18-21,05,18,21,02,00,Carlsbad,CA,Light,&gt;30 minutes,Orange dim lit orb floating in and out of the ocean,http://www.nuforc.org/webreports/163/S163268.html
13,05-18-21T00:30:00Z,05-18-21,05,18,21,00,30,Lompoc,CA,Circle,5 minutes,Strange lights formation disappearing in mid air over lompoc Ca near Airforce base.,http://www.nuforc.org/webreports/163/S163282.html
14,05-17-21T22:07:00Z,05-17-21,05,17,21,22,07,Senoia,GA,Light,1 min,Light object traveling across sky reacting to second light and defying logic of  coomon air travel,http://www.nuforc.org/webreports/163/S163242.html
15,05-17-21T21:30:00Z,05-17-21,05,17,21,21,30,Sherbrooke (Canada),QC,Fireball,25 seconds,Looked like pieces of falling meteor...instead of burning out they spaced out evenly and flew North parallel to earth at great speed.,http://www.nuforc.org/webreports/163/S163246.html
16,05-17-21T11:00:00Z,05-17-21,05,17,21,11,00,Bouctouche,,Disk,5mins,Weird lights and flying oval object with windows??!!?,http://www.nuforc.org/webreports/163/S163288.html
17,05-17-21T02:08:00Z,05-17-21,05,17,21,02,08,Northern Ireland,,Light,40seconds,There was a double line of star like lights in the following formation.: : : : : : : : : They moved in unison from west to east slo,http://www.nuforc.org/webreports/163/S163204.html
18,05-17-21T01:20:00Z,05-17-21,05,17,21,01,20,Meridian,ID,Other,~5 minutes,What looked to be a sparkling contrail was actually a massive illuminated ship that crossed the sky.,http://www.nuforc.org/webreports/163/S163215.html
19,05-17-21T01:20:00Z,05-17-21,05,17,21,01,20,Meridian,ID,Other,~5 minutes,What looked to be a sparkling contrail was actually a massive illuminated ship that crossed the sky.,http://www.nuforc.org/webreports/163/S163222.html
20,05-17-21T00:20:00Z,05-17-21,05,17,21,00,20,Fall River,MA,Fireball,3 minutes,"Early Monday morning, I was sitting on my deck looking north east that's  when I noticed a large red and orange ball of light just unde",http://www.nuforc.org/webreports/163/S163252.html
21,05-17-21T00:20:00Z,05-17-21,05,17,21,00,20,Susanville,CA,Other,2 min,"We were facing North(towards Alturas with the Sierra Nevada Mountains to our back). A &quot;string&quot; of 20 to 25 lights, moving fro",http://www.nuforc.org/webreports/163/S163221.html
22,05-17-21T00:07:00Z,05-17-21,05,17,21,00,07,Bogota,NJ,Circle,1-3 minutes,Bright green lights in the sky.,http://www.nuforc.org/webreports/163/S163239.html
23,05-17-21T00:07:00Z,05-17-21,05,17,21,00,07,Bridgewater,NH,Cylinder,3.4 minutes,"Cylindrical shape craft hovered in Northeast sky for 1 minute, then moved slowly eastward for 2.4 minutes before disappearing from view",http://www.nuforc.org/webreports/163/S163213.html
24,05-17-21T00:06:00Z,05-17-21,05,17,21,00,06,North Tonawanda,NY,Oval,,Large oval shaped object spotted with lights that had the appearance of shooting stars but it wasn't.,http://www.nuforc.org/webreports/163/S163223.html
25,05-17-21T00:00:00Z,05-17-21,05,17,21,00,00,Rutland,VT,Light,3 Min,String of Lights In The Sky,http://www.nuforc.org/webreports/163/S163230.html
26,05-16-21T23:38:00Z,05-16-21,05,16,21,23,38,Red Deer,AB,,5 Minutes,Organized line of bright objects,http://www.nuforc.org/webreports/163/S163227.html
27,05-16-21T23:10:00Z,05-16-21,05,16,21,23,10,Richland,WA,Circle,.5 hour,3 events of multiple UFO’ a with 1/2 hour span,http://www.nuforc.org/webreports/163/S163224.html
28,05-16-21T23:00:00Z,05-16-21,05,16,21,23,00,Bellingham,WA,Light,20 min,numerous pinpricks of light following each other evenly spaced,http://www.nuforc.org/webreports/163/S163236.html
29,05-16-21T22:40:00Z,05-16-21,05,16,21,22,40,Keizer,OR,Circle,5 minutes or longer,This was either a formation or a single craft with many lights on the outside. It was moving very slowly across the sky above my house.,http://www.nuforc.org/webreports/163/S163225.html
30,05-16-21T21:30:00Z,05-16-21,05,16,21,21,30,Williamsport,MD,Formation,10 minutes?,"varying pattern of blinking lights VERY bright, shaped like an inverted question mark",http://www.nuforc.org/webreports/163/S163216.html
31,05-16-21T20:15:00Z,05-16-21,05,16,21,20,15,Grand Rapids,MI,Light,1-2 minutes,Bright white light in twilight sky.,http://www.nuforc.org/webreports/163/S163211.html
32,05-16-21T20:00:00Z,05-16-21,05,16,21,20,00,hiram,GA,Other,2 minutes,"metallic craft at high altitude with no contrail,obviuosly not an aerodynamic craft",http://www.nuforc.org/webreports/163/S163212.html
33,05-16-21T19:00:00Z,05-16-21,05,16,21,19,00,Jacksonville,NC,Circle,Hour,Three bright orbs spaced apart and aligned with the moon.,http://www.nuforc.org/webreports/163/S163198.html
34,05-16-21T18:30:00Z,05-16-21,05,16,21,18,30,Frenchtown,NJ,Other,2 minutes,Black object effortlessly floated without the use of wings or engine.,http://www.nuforc.org/webreports/163/S163203.html
35,05-16-21T18:00:00Z,05-16-21,05,16,21,18,00,Glendale,CA,Sphere,10 min,Black spherical ufo,http://www.nuforc.org/webreports/163/S163200.html
36,05-16-21T15:55:00Z,05-16-21,05,16,21,15,55,Niagara falls,NY,Oval,2 minutes,Black oval object with windows shot straight up through cloud's,http://www.nuforc.org/webreports/163/S163180.html
37,05-16-21T15:45:00Z,05-16-21,05,16,21,15,45,New Baltimore,MI,Circle,3 minutes,Reflective slow moving white ball,http://www.nuforc.org/webreports/163/S163202.html
38,05-16-21T14:30:00Z,05-16-21,05,16,21,14,30,San Pedro,CA,Circle,10-15 seconds,Unbelievable! Very large circle shadow drifted across the water and docks at the port of los angeles headed north east.shadow was about,http://www.nuforc.org/webreports/163/S163228.html
39,05-16-21T12:42:00Z,05-16-21,05,16,21,12,42,Otsego,MN,Disk,2 min,We observed a comet about 10 minutes before. We were fishing by the boat launch opening and looked up and say a line of lights. The li,http://www.nuforc.org/webreports/163/S163238.html
40,05-16-21T12:05:00Z,05-16-21,05,16,21,12,05,Plymouth,MA,Cigar,3 min,"Large dull white cigar or disc hovered, gradually glided east where it vanished as if the night sky absorbed it, it made no sound",http://www.nuforc.org/webreports/163/S163234.html
41,05-16-21T10:00:00Z,05-16-21,05,16,21,10,00,Portland,OR,Formation,10 seconds,Formation of lights across the night sky in Portland,http://www.nuforc.org/webreports/163/S163207.html
42,05-16-21T09:54:00Z,05-16-21,05,16,21,09,54,Vincent,AL,Light,35 minutes,Two objects were headed towards each other then they stopped abruptly. They headed east and 3 other objects came from the east and stop,http://www.nuforc.org/webreports/163/S163264.html
43,05-16-21T09:30:00Z,05-16-21,05,16,21,09,30,ROCHESTER,NY,Rectangle,3 seconds,At around 9:30pm may 16 2021 we had a crescent moon so i brought out the telescope to look at the moon. while looking at a the moon ver,http://www.nuforc.org/webreports/163/S163217.html
44,05-16-21T09:00:00Z,05-16-21,05,16,21,09,00,McDonald,PA,Unknown,1.5 hours,"15 crafts in space that raced, darted, faded in and out, pretended to be stars, and wobbled in all directions in the sky.",http://www.nuforc.org/webreports/163/S163235.html
45,05-16-21T08:17:00Z,05-16-21,05,16,21,08,17,Belen,NM,Circle,10 min,As I pulled to the light on my way into the city for work I noticed a big silver metal sphere in the sky not moving so I pulled over an,http://www.nuforc.org/webreports/163/S163231.html
46,05-16-21T05:30:00Z,05-16-21,05,16,21,05,30,Fort Myers,FL,Other,~2,Quick moving object in the sky,http://www.nuforc.org/webreports/163/S163187.html
47,05-16-21T04:00:00Z,05-16-21,05,16,21,04,00,Newberg,OR,Light,Aprox: 2 minutes,"there was a spherical light emitting a green laser, pointing diagonally towards the surface of the ground. from the lazer were smaller",http://www.nuforc.org/webreports/163/S163256.html
48,05-16-21T01:00:00Z,05-16-21,05,16,21,01,00,Kamloops (Canada),BC,Cigar,1 minute,"Lackluster sighting in comparison to other sightings, but , I was camping with my girlfriend  when we noticed what we initially thought",http://www.nuforc.org/webreports/163/S163248.html
49,05-16-21T00:12:00Z,05-16-21,05,16,21,00,12,Bowdoin,ME,Formation,10 seconds,Very large silent Light formation moving at plane speed.,http://www.nuforc.org/webreports/163/S163233.html
50,05-16-21T00:05:00Z,05-16-21,05,16,21,00,05,Utica,NY,Other,30,Seen A Stick Shaped UFO,http://www.nuforc.org/webreports/163/S163197.html
51,05-15-21T23:39:00Z,05-15-21,05,15,21,23,39,Nampa,ID,Triangle,3 minutes,My father and I were coming back from Lake Lowell and on our way back home we noticed a long low glowing bar of light floating along th,http://www.nuforc.org/webreports/163/S163183.html
52,05-15-21T23:37:00Z,05-15-21,05,15,21,23,37,Emigrant,MT,Light,20 minutes,String of Attached Lights with No Sound Moving Towards Us,http://www.nuforc.org/webreports/163/S163209.html
53,05-15-21T23:37:00Z,05-15-21,05,15,21,23,37,Emigrant,MT,Light,20 minutes,String of Attached Lights with No Sound Moving Towards Us,http://www.nuforc.org/webreports/163/S163214.html
54,05-15-21T23:30:00Z,05-15-21,05,15,21,23,30,Rochester,MI,Sphere,3 minutes,Silver Sphere Ufo,http://www.nuforc.org/webreports/163/S163162.html
55,05-15-21T23:30:00Z,05-15-21,05,15,21,23,30,Star,ID,Disk,10 minutes,UFO in Star Idaho,http://www.nuforc.org/webreports/163/S163189.html
56,05-15-21T22:55:00Z,05-15-21,05,15,21,22,55,Holland,MI,Circle,20 lus minutes,I use the ce5 protocols and got footage totally by accident  i was sitting  on my porch recording and it wasn't until after I looked an,http://www.nuforc.org/webreports/163/S163226.html
57,05-15-21T22:45:00Z,05-15-21,05,15,21,22,45,randle,WA,Disk,4 minutes,Two friends and i witnessed several bright balls of light in the sky heading northeast at 10:30 pm then at 1045 we observed a very larg,http://www.nuforc.org/webreports/163/S163208.html
58,05-15-21T22:38:00Z,05-15-21,05,15,21,22,38,Salem,OR,Cylinder,2 1/2 min,"Self illuminating craft, cylinder shape, mile long moving at constant speed.  No wings or other lighting seen.  No sound.",http://www.nuforc.org/webreports/163/S163181.html
59,05-15-21T22:38:00Z,05-15-21,05,15,21,22,38,Salem,OR,Cylinder,2 1/2 min,"Self illuminating craft, cylinder shape, mile long moving at constant speed.  No wings or other lighting seen.  No sound.",http://www.nuforc.org/webreports/163/S163190.html
60,05-15-21T22:37:00Z,05-15-21,05,15,21,22,37,Concrete,WA,Other,4 minutes,Linear white lights on object slowly floating in sky..like nothing I have ever seen before. Inexplicable.,http://www.nuforc.org/webreports/163/S163177.html
61,05-15-21T22:36:00Z,05-15-21,05,15,21,22,36,Longview,WA,Cylinder,5 minutes,Object that looked like a string of pearls in the sky.,http://www.nuforc.org/webreports/163/S163184.html
62,05-15-21T22:36:00Z,05-15-21,05,15,21,22,36,Sisters,OR,Cigar,4 minutes,"Long and narrow illuminated craft flying high and somewhat slowly over Oregon (5-15-21, 22:36); 4 whitnesses",http://www.nuforc.org/webreports/163/S163220.html
63,05-15-21T22:35:00Z,05-15-21,05,15,21,22,35,Vancouver,WA,Cigar,1-3 minutes,"Oblong white light travelling west to east slowly in northern sky's of Vancouver, Washington",http://www.nuforc.org/webreports/163/S163186.html
64,05-15-21T22:35:00Z,05-15-21,05,15,21,22,35,Jacksonville,OR,Cigar,1 min. 30 sec,Cigar shaped slightly illuminated object moving North-NorthEast.,http://www.nuforc.org/webreports/163/S163191.html
65,05-15-21T22:35:00Z,05-15-21,05,15,21,22,35,Carson,WA,Rectangle,5 minutes,"A large horizontal bar of light moved slowly across the night sky, eventually lifting its back end to 45 degrees and maintaining course",http://www.nuforc.org/webreports/163/S163286.html
66,05-15-21T22:30:00Z,05-15-21,05,15,21,22,30,Conconully,WA,Cylinder,4 Min,"On a camping trip, and after my wife went to bed I was standing at the campfire looking up at all of the stars. I saw a long patch of w",http://www.nuforc.org/webreports/163/S163258.html
67,05-15-21T22:30:00Z,05-15-21,05,15,21,22,30,Glasgow,MT,Rectangle,5 minutes,"Three individuals witnessed a brightly lit but silent very large object for 5 minutes at 10:30pm on 5/15/2021 west of Glasgow, MT.",http://www.nuforc.org/webreports/163/S163210.html
68,05-15-21T22:30:00Z,05-15-21,05,15,21,22,30,Ferndale,WA,Cylinder,four min,saw a green segmented object slowly traveling thru the sky,http://www.nuforc.org/webreports/163/S163247.html
69,05-15-21T22:30:00Z,05-15-21,05,15,21,22,30,Kissimmee,FL,Light,1 minute,"I was outside preying looked up, and the picture says it all. I usually have about 3 sightings a week where I am.",http://www.nuforc.org/webreports/163/S163179.html
70,05-15-21T22:06:00Z,05-15-21,05,15,21,22,06,Chautauqua Lake,NY,Light,35 minutes,"Six bright white fast moving lights appeared above us, one of which passed under a jet and followed our boat.",http://www.nuforc.org/webreports/163/S163193.html
71,05-15-21T21:30:00Z,05-15-21,05,15,21,21,30,Highbridge,NJ,Cylinder,Under 5 minutes,Brilliant orange cylinder with points of white. Appeared translucent and had a deliberate flight path,http://www.nuforc.org/webreports/163/S163293.html
72,05-15-21T21:00:00Z,05-15-21,05,15,21,21,00,Medford,OR,Circle,35 minutes,Orange pulsating lights in a square formation to a straight line formation,http://www.nuforc.org/webreports/163/S163185.html
73,05-15-21T20:40:00Z,05-15-21,05,15,21,20,40,New York City (Brooklyn),NY,Circle,15 mins,11 glowing orange disc flew silently across the sky. They had no visible way of propulsion and looked like bright circles.,http://www.nuforc.org/webreports/163/S163195.html
74,05-15-21T20:15:00Z,05-15-21,05,15,21,20,15,New Hanover Township,PA,Circle,2 - 3 minutes,about 15 orange circular objects flying at low altitude.,http://www.nuforc.org/webreports/163/S163188.html
75,05-15-21T11:50:00Z,05-15-21,05,15,21,11,50,Burnsville,MN,Disk,5 sec,Animated looking green glowing flying saucer,http://www.nuforc.org/webreports/163/S163194.html
76,05-15-21T06:10:00Z,05-15-21,05,15,21,06,10,Kakinada (India),,Oval,few seconds,Spotted UFO from close distance while jogging on beach,http://www.nuforc.org/webreports/163/S163253.html
77,05-15-21T05:00:00Z,05-15-21,05,15,21,05,00,Amherst (Canada),NS,Disk,45 seconds,Silent very fast moving disc shape before daylight lot up the disc as I seen clearly and what looked like two smaller ones exiting it,http://www.nuforc.org/webreports/163/S163240.html
78,05-15-21T04:00:00Z,05-15-21,05,15,21,04,00,Kelseyville,CA,Sphere,2 minutes,Silent red orange orb,http://www.nuforc.org/webreports/163/S163164.html
79,05-15-21T00:45:00Z,05-15-21,05,15,21,00,45,Storden,MN,Cigar,1:00,As I was closing the local bar alone. I looked up to the north and saw a subtle shiny object. It was shaped like a blimp or cigar. It a,http://www.nuforc.org/webreports/163/S163243.html
80,05-14-21T23:50:00Z,05-14-21,05,14,21,23,50,North Myrtle Beach,SC,Changing,30+,Many lights over North Myrtle Beach ocean moving erratically,http://www.nuforc.org/webreports/163/S163156.html
81,05-14-21T23:05:00Z,05-14-21,05,14,21,23,05,Eaton,OH,Sphere,3 minutes,Orb in the sky looked like a turning ball of light. It went back and forth and closer and then farther away. I recorded it with my cell,http://www.nuforc.org/webreports/163/S163166.html
82,05-14-21T21:30:00Z,05-14-21,05,14,21,21,30,Ironwood,MI,Circle,,It was a clear night in May 14 2021. I saw a bright white “star-like” thing in the sky. It was moving. I was looking west of Ironwood.,http://www.nuforc.org/webreports/163/S163290.html
83,05-14-21T18:40:00Z,05-14-21,05,14,21,18,40,Warner Robins,GA,Changing,10 minutes,Shape shifting object that shimmered and or produced white yellow lights in different spots.,http://www.nuforc.org/webreports/163/S163170.html
84,05-14-21T14:00:00Z,05-14-21,05,14,21,14,00,Kingwood,TX,Sphere,15-20 minutes,Ball shaped uap over northeast Houston in broad daylight.,http://www.nuforc.org/webreports/163/S163260.html
85,05-14-21T09:30:00Z,05-14-21,05,14,21,09,30,Lincoln,GA,Cigar,Around 3 minutes or short,A white cigar shaped craft stationary and flashing in the sky.,http://www.nuforc.org/webreports/163/S163152.html
86,05-14-21T09:30:00Z,05-14-21,05,14,21,09,30,Lincoln,GA,Cigar,Around 3 minutes or short,A white cigar shaped craft stationary and flashing in the sky.,http://www.nuforc.org/webreports/163/S163154.html
87,05-14-21T04:17:00Z,05-14-21,05,14,21,04,17,St. Thomas (Canada),ON,Circle,1.5 Minutes,Two lights moving in sync.,http://www.nuforc.org/webreports/163/S163173.html
88,05-14-21T04:13:00Z,05-14-21,05,14,21,04,13,Los Alamos,NM,Sphere,8 minutes,Bright gold ball low in the sky in a perfect straight line going east,http://www.nuforc.org/webreports/163/S163169.html
89,05-13-21T22:30:00Z,05-13-21,05,13,21,22,30,Holden Beach,OH,Light,1/2 hour,My daughter and I were sitting on our beach house back deck when we saw two yellow lights over the ocean in the southern sky. The light,http://www.nuforc.org/webreports/163/S163160.html
90,05-13-21T21:30:00Z,05-13-21,05,13,21,21,30,Mississauga (Canada),ON,Light,1-2 mins,A bright colourful large object in Mississauga disappeared into a bright white ball of light,http://www.nuforc.org/webreports/163/S163199.html
91,05-13-21T21:05:00Z,05-13-21,05,13,21,21,05,Shelbyville,IN,Light,1-2 minutes,It was just a light. Moved around seemed to zoom out of view and back in one or twice.,http://www.nuforc.org/webreports/163/S163114.html
92,05-13-21T21:00:00Z,05-13-21,05,13,21,21,00,Marysville,WA,Changing,3 hours,Immense colorful shapeshifting Orb illuminating hovering in the sky.,http://www.nuforc.org/webreports/163/S163249.html
93,05-13-21T01:30:00Z,05-13-21,05,13,21,01,30,La grande,OR,Formation,2-4 minutes,5-9 tightly grouped objects in a line,http://www.nuforc.org/webreports/163/S163159.html
94,05-13-21T01:00:00Z,05-13-21,05,13,21,01,00,Radcliff,KY,,30 Min,Cancer and Grey Beings,http://www.nuforc.org/webreports/163/S163241.html
95,05-12-21T23:00:00Z,05-12-21,05,12,21,23,00,Naples,FL,Disk,5 min.,Saw 3 UFOs hovering above - looked like they were playing games flying around each other amongst the three saucers,http://www.nuforc.org/webreports/163/S163157.html
96,05-12-21T21:30:00Z,05-12-21,05,12,21,21,30,Atascadero,CA,Light,7 hours,"These light have been seen floating in air, zig zagging , falling from sky, finally flew to camera",http://www.nuforc.org/webreports/163/S163141.html
97,05-12-21T20:28:00Z,05-12-21,05,12,21,20,28,Hephzibah,GA,Unknown,About a minute,"Just before sunset, an aircraft with three bright white lights hovered over the highway treeline observing traffic.",http://www.nuforc.org/webreports/163/S163151.html
98,05-12-21T20:28:00Z,05-12-21,05,12,21,20,28,Hephzibah,GA,Unknown,About a minute,"Just before sunset, an aircraft with three bright white lights hovered over the highway treeline observing traffic.",http://www.nuforc.org/webreports/163/S163147.html
99,05-12-21T19:40:00Z,05-12-21,05,12,21,19,40,Tehachapi,CA,Disk,ca 20 seconds,"single small disc like a helium balloon but flying overhead straight, steady, silent and fast just after sunset. No wind.",http://www.nuforc.org/webreports/163/S163146.html
100,05-12-21T02:36:00Z,05-12-21,05,12,21,02,36,Saint Clairsville,OH,Oval,25 minutes,Metallic white almond shaped object  with bright blue aura in dense woodland,http://www.nuforc.org/webreports/163/S163148.html
101,05-12-21T01:00:00Z,05-12-21,05,12,21,01,00,Phillipsburg,NJ,Circle,,Many people in town has reported about 2 circles glowing redi-sh orange. The one was bigger than the other and the like pulsating. Witn,http://www.nuforc.org/webreports/163/S163172.html
102,05-11-21T05:03:00Z,05-11-21,05,11,21,05,03,Atlantic Beach,FL,Unknown,Seems like an hour,I noticed the unidentified bright lights and vertically aligned squared shaped objects moving sporadically as seen on the security cam.,http://www.nuforc.org/webreports/163/S163113.html
103,05-10-21T23:00:00Z,05-10-21,05,10,21,23,00,Taylor,MI,Oval,All night,Dark spots in the night are UFO.s,http://www.nuforc.org/webreports/163/S163111.html
104,05-10-21T22:00:00Z,05-10-21,05,10,21,22,00,Sarasota,FL,Other,2 minutes,String of lights,http://www.nuforc.org/webreports/163/S163108.html
105,05-10-21T21:18:00Z,05-10-21,05,10,21,21,18,Cairo (Egypt),,Unknown,~5 minutes,Line of stars exceeding 25 moving slowly,http://www.nuforc.org/webreports/163/S163105.html
106,05-10-21T11:00:00Z,05-10-21,05,10,21,11,00,Naples,FL,Circle,10 min.,UFO sighting,http://www.nuforc.org/webreports/163/S163109.html
107,05-10-21T10:30:00Z,05-10-21,05,10,21,10,30,Tampa,FL,Oval,3 seconds,"I was driving home, headed southbound on Bayshore Blvd. approaching Gandy Blvd. driving 35mph.  Approximately 6 or 7 streets north of G",http://www.nuforc.org/webreports/163/S163155.html
108,05-09-21T23:30:00Z,05-09-21,05,09,21,23,30,Mobile,AL,Circle,3 min,Orange Light Over Mobile AL,http://www.nuforc.org/webreports/163/S163106.html
109,05-09-21T23:30:00Z,05-09-21,05,09,21,23,30,Beaconsfield,QC,Formation,2-3 minutes that we saw,"I just returned from walking my dog when I turned to the NW and saw what I thought were 3 stars, but then noticed one was moving, then",http://www.nuforc.org/webreports/163/S163101.html
110,05-09-21T22:25:00Z,05-09-21,05,09,21,22,25,Port Charlotte,FL,Sphere,11 seconds,My home security camera captured two spheres of light hovering around. It appeared as if they were aware of each other. Then the bigges,http://www.nuforc.org/webreports/163/S163100.html
111,05-09-21T21:30:00Z,05-09-21,05,09,21,21,30,Ocala,FL,Formation,2 minutes,Flying line Formation of unidentifiable objects in clear sky,http://www.nuforc.org/webreports/163/S163099.html
112,05-09-21T20:30:00Z,05-09-21,05,09,21,20,30,Kailua,HI,Unknown,5 minutes,Zooming ball of light in the Hawaiian night sky defying all propulsion physics.,http://www.nuforc.org/webreports/163/S163161.html
113,05-09-21T13:30:00Z,05-09-21,05,09,21,13,30,Nice,CA,Disk,5 seconds,"A silent disk went over me, my fiance and my son's head and out over the water of Clear Lake.",http://www.nuforc.org/webreports/163/S163055.html
114,05-09-21T03:10:00Z,05-09-21,05,09,21,03,10,Minneapolis,MN,Light,,blue light crash.  cube space craft with yellow lights,http://www.nuforc.org/webreports/163/S163063.html
115,05-09-21T02:39:00Z,05-09-21,05,09,21,02,39,Nokomis,FL,Circle,3 seconds,Ball of fire.  1/8 th inch from my perspective.  No light trail.  Looks like landed in Gulf of Mexico.  Did not look like shooting star,http://www.nuforc.org/webreports/163/S163064.html
116,05-08-21T23:49:00Z,05-08-21,05,08,21,23,49,Evansville,IN,Circle,,Circle of light going around in a circle in the sky.,http://www.nuforc.org/webreports/163/S163066.html
117,05-08-21T23:00:00Z,05-08-21,05,08,21,23,00,Santa Rosa,CA,Light,15 minutes,My sister her husband and I were viewing the stars last night. At first we thought we were seeing the starlink satellites but they were,http://www.nuforc.org/webreports/163/S163056.html
118,05-08-21T23:00:00Z,05-08-21,05,08,21,23,00,Chisholm,MN,Circle,20 minutes,"Hundres of white lights traveling in the same direction and same speed west to east over Chisholm mn , there was a pattern ( ***   **",http://www.nuforc.org/webreports/163/S163071.html
119,05-08-21T21:45:00Z,05-08-21,05,08,21,21,45,Shrewsbury,PA,Formation,2 minutes,"Small lights circulating in a straight line, over and over",http://www.nuforc.org/webreports/163/S163074.html
120,05-08-21T21:40:00Z,05-08-21,05,08,21,21,40,Camp Hill,PA,Circle,2 minutes,White dots moving in a line.,http://www.nuforc.org/webreports/163/S163077.html
